Video ID,Title,Description,Channel Title,Keyword Tags,YouTube Video Category,Topic Details,Video Published at,Video Duration,View Count,Comment Count,Captions Available,Caption Text,Location
gCYcHz2k5x0,Martin Garrix - Animals (Official Video),Martin Garrix - Animals (Official Video) Listen / Download: http://stmpd.co/ANMLSID Martin Garrix delivers this powerful anthem ...,STMPD RCRDS,,,"['https://en.wikipedia.org/wiki/Electronic_music', 'https://en.wikipedia.org/wiki/Music', 'https://en.wikipedia.org/wiki/Pop_music']",,,1766013562,343608,false,,N/A
QtXby3twMmI,Coldplay - Adventure Of A Lifetime (Official Video),Coldplay's tenth studio album Moon Music available to listen/ buy now! https://coldplay.lnk.to/MoonMusic Coldplay - Adventure ...,Coldplay,,,"['https://en.wikipedia.org/wiki/Electronic_music', 'https://en.wikipedia.org/wiki/Independent_music', 'https://en.wikipedia.org/wiki/Music', 'https://en.wikipedia.org/wiki/Pop_music']",,,1592617558,188881,true,,N/A
YXwnKgSXFKE,Monkey Baby Bon Bon oes to the toilet and plays with Ducklings in the swimming pool,Monkey Baby Bon Bon oes to the toilet and plays with Ducklings in the swimming pool #babymonkey #Animal #Animalht I'm Bon ...,Animal HT,,,"['https://en.wikipedia.org/wiki/Lifestyle_(sociology)', 'https://en.wikipedia.org/wiki/Pet']",,,1367595382,0,false,,N/A
qpgTC9MDx1o,Maroon 5 - Animals,Maroon 5 - Animals Director: Samuel Bayer Buy Now! http://smarturl.it/M5V Sign up for updates: http://smarturl.it/Maroon5.News.,Maroon5VEVO,,,"['https://en.wikipedia.org/wiki/Music', 'https://en.wikipedia.org/wiki/Pop_music']",,,946230572,195342,true,,N/A
mRD0-GxqHVo,Glass Animals - Heat Waves (Official Video),I LOVE YOU SO F***ING MUCH. Our fourth studio album. Out now. Order :: https://glassanimals.lnk.to/loveYT Official store ...,GlassAnimalsVEVO,,,"['https://en.wikipedia.org/wiki/Hip_hop_music', 'https://en.wikipedia.org/wiki/Independent_music', 'https://en.wikipedia.org/wiki/Music', 'https://en.wikipedia.org/wiki/Pop_music']",,,755944935,188450,true,,N/A
h8Q-jlHBcXM,Animal Sounds for Children (20 Amazing Animals),Have a look at our 'I Love Animals' videos for kids ...,oxbridgebaby,,,[],,,595676932,0,false,,N/A
xat1GVnl8-k,Bloodhound Gang - The Bad Touch,"The official video of Bloodhound Gang's ""The Bad Touch"" of their 1999 album ""Hooray For Boobies“. ""Hooray For Boobies"" 25th ...",BloodhoundGangVEVO,,,"['https://en.wikipedia.org/wiki/Electronic_music', 'https://en.wikipedia.org/wiki/Independent_music', 'https://en.wikipedia.org/wiki/Music', 'https://en.wikipedia.org/wiki/Pop_music', 'https://en.wikipedia.org/wiki/Rock_music']",,,491984174,101228,false,,N/A
8bTQMDM4qvY,"Spot The Fake Animal For $10,000",,MrBeast,,,['https://en.wikipedia.org/wiki/Entertainment'],,,394510274,26697,false,,N/A
cGE0S3V9uSc,Diana feeds animals at the zoo,Diana and Roma playing at the zoo with animals and feeds them. Feeding the animals was interesting for kids Instagram Diana: ...,✿ Kids Diana Show,,,['https://en.wikipedia.org/wiki/Lifestyle_(sociology)'],,,385018709,0,false,,N/A
47MNn4bsmSw,"Learn Animals with Ms Rachel for Toddlers - Animal Sounds, Farm Animals, Nursery Rhymes &amp; Kids Songs","Have your toddler learn with a real teacher, Ms Rachel! Ms Rachel has packed so much important learning into this “Learn ...",Ms Rachel - Toddler Learning Videos,,,['https://en.wikipedia.org/wiki/Lifestyle_(sociology)'],,,382428359,0,true,,N/A
xPeIm20TYjI,Charly Black - Gyal You A Party Animal,"Charly Black's ""Gyal You A Party Animal"" is a hot & fresh new dancehall jam with lush melodies designed to get you moving on ...",CharlyBlackVEVO,,,"['https://en.wikipedia.org/wiki/Electronic_music', 'https://en.wikipedia.org/wiki/Hip_hop_music', 'https://en.wikipedia.org/wiki/Music', 'https://en.wikipedia.org/wiki/Music_of_Latin_America', 'https://en.wikipedia.org/wiki/Pop_music', 'https://en.wikipedia.org/wiki/Reggae']",,,373394197,36382,true,,N/A
MBVpWsa0y3k,Animals teach us love ❤️,The only way for humanity to evolve is by allowing the force of love to guide us. When we strive to love all living beings and refrain ...,Kinder World,,,"['https://en.wikipedia.org/wiki/Lifestyle_(sociology)', 'https://en.wikipedia.org/wiki/Pet']",,,363855689,148345,false,,N/A
RVJbKPW3Crs,Domestic animals of the farm,Teach your children about the many different animals on the farm.,bunbun,,,['https://en.wikipedia.org/wiki/Knowledge'],,,358153368,0,false,,N/A
rW3Trtfu8Vo,Different animals cliff diving styles in #bluetreephuket,,watermagic #shorts,,,"['https://en.wikipedia.org/wiki/Lifestyle_(sociology)', 'https://en.wikipedia.org/wiki/Tourism']",,,273591198,1380,false,,N/A
iAIBF2ngbWY,"ANIMAL:Pehle Bhi Main(Full Video) | Ranbir Kapoor,Tripti Dimri |Sandeep V |Vishal M,Raj S |Bhushan K","Presenting the Full Video Song ""Pehle Bhi Main"" from The Film Animal Starring Ranbir Kapoor, Rashmika Mandanna, Anil Kapoor ...",T-Series,,,"['https://en.wikipedia.org/wiki/Film', 'https://en.wikipedia.org/wiki/Music', 'https://en.wikipedia.org/wiki/Music_of_Asia']",,,262239123,29180,false,,N/A
xqds0B_meys,Three Days Grace - Animal I Have Become,Three Days Grace's official music video for 'Animal I Have Become' Listen: https://3DG.lnk.to/StreamYT Buy/Stream: ...,ThreeDaysGraceVEVO,,,"['https://en.wikipedia.org/wiki/Electronic_music', 'https://en.wikipedia.org/wiki/Music', 'https://en.wikipedia.org/wiki/Pop_music', 'https://en.wikipedia.org/wiki/Rock_music']",,,258365356,63211,true,,N/A
YCvzPBUPZ9w,Animal Sounds for Children (20 Amazing Animals),Have a look at our 'I Love Animals' videos for kids ...,Art,,,[],,,252959334,0,false,,N/A
t4j8JWKGjVY,Endangered Animals Part-1 #animalshorts #kidsshorts #kidslearning #elephant #animals #kidsfun #funny,Subscribe and watch full version of the songs and funny shows uploaded every week. ☆ YouTube Channel: /@ChuChuTV Check ...,ChuChu TV Nursery Rhymes & Kids Songs,,,"['https://en.wikipedia.org/wiki/Entertainment', 'https://en.wikipedia.org/wiki/Film', 'https://en.wikipedia.org/wiki/Television_program']",,,249405295,0,false,,N/A
zqGW6x_5N0k,"ANIMAL: ARJAN VAILLY | Ranbir Kapoor | Sandeep Vanga | Bhupinder B, Manan B | Bhushan K","WITNESS THE TRUE RAGE & VIOLENCE! PRESENTING THE MOST AWAITED SONG ""ARJAN VAILLY"" FROM THE HIGHLY ...",T-Series,,,"['https://en.wikipedia.org/wiki/Film', 'https://en.wikipedia.org/wiki/Music', 'https://en.wikipedia.org/wiki/Music_of_Asia']",,,249488108,27899,false,,N/A
6pRNg7Z-4QU,Baby kangaroo is peeking out of the pouch 🥰🦘 #animals #cuteanimals #shorts,,San Antonio Zoo,,,[],,,240149127,2705,false,,N/A
7BJ3ZXpserc,Maroon 5 - Animals (Lyric Video),Pre-Order V on iTunes ft Animals: http://smarturl.it/M5V Sign up for updates: http://smarturl.it/Maroon5.News Music video by ...,Maroon5VEVO,,,"['https://en.wikipedia.org/wiki/Music', 'https://en.wikipedia.org/wiki/Pop_music']",,,233448395,25728,true,,N/A
LY1oAC1nUaw,Holiday Farm Kids Song - Hooray Kids Music #shorts #animals #farm #hooraykidssongs,"Sing-along with the ""Holiday on the farm"" kids song: https://www.youtube.com/watch?v=2PJHaYkjTgY For more funny kids songs, ...",Hooray Kids Songs & Nursery Rhymes,,,"['https://en.wikipedia.org/wiki/Entertainment', 'https://en.wikipedia.org/wiki/Film']",,,229469349,0,false,,N/A
vQY1L-oUREU,The girl adopted baby hedgehog in her house #shorts,We created this story with the intention of sharing heartwarming messages about the bond between humans and animals.,AnimalLove Stories,,,[],,,218112801,50880,false,,N/A
Kd3yQ6ekMEw,Wheels On The Bus Song Baby Animals + more Baby Songs &amp; Nursery Rhymes,Wheels On The Bus Song Baby Animals + more Baby Songs & Nursery Rhymes Wheels on the Bus | New Kids Songs & Nursery ...,Lalafun - Kids Songs US,,,['https://en.wikipedia.org/wiki/Music'],,,204787523,0,false,,N/A
_Z0ZQT0FttM,Toddler Learning with Ms Rachel - Learn Zoo Animals - Kids Songs - Educational Videos for Toddlers,"Learn with a real teacher, Ms Rachel! In this toddler learning video, Ms Rachel packs in so much important learning for toddlers!",Ms Rachel - Toddler Learning Videos,,,"['https://en.wikipedia.org/wiki/Entertainment', 'https://en.wikipedia.org/wiki/Television_program']",,,195311226,0,true,,N/A
0GVExpdmoDs,Maroon 5 - Animals (Lyrics),Maroon 5 - Animals (Lyrics) ⏬ Download / Stream: http://smarturl.it/M5V Turn on notifications to stay updated with new uploads!,7clouds,,,"['https://en.wikipedia.org/wiki/Music', 'https://en.wikipedia.org/wiki/Pop_music']",,,189275677,36852,false,,N/A
ESW3oam9eGQ,Detective Bibib!🕵️ #funnyanimals #owl #funnyvideo #funny #animals #cute #cuteanimals #owls,Detective Bibib is looking for the suspect who doing his duty on the couch!,Bibib Family,,,"['https://en.wikipedia.org/wiki/Entertainment', 'https://en.wikipedia.org/wiki/Pet']",,,187786210,5947,false,,N/A
QpQ4G3KjY2c,Which animals will bite me??? #animals #coolanimals #dangerousanimals #animalsofyoutube,,TyAmongAnimals,,,['https://en.wikipedia.org/wiki/Entertainment'],,,165594393,25923,false,,N/A
SdNHuBu8zXo,Animal Running - Surprise Magic | Hindi Rhymes &amp; Cartoons | Infobells,A fun-filled animal running race video with surprise magic elements. #hindicartoons #hindirhymes #infobells #animalsounds ...,Infobells - Hindi,,,"['https://en.wikipedia.org/wiki/Entertainment', 'https://en.wikipedia.org/wiki/Film']",,,163464644,0,false,,N/A
6wMyN2suqiU,Rabbit Growth - Baby Animals 1 To 16 Days,Baby Animals 1 To 16 Days cute baby rabbit growing video cute baby animals growing video baby rabbits baby bunnies baby ...,DoDo HosS,,,['https://en.wikipedia.org/wiki/Pet'],,,159559327,10565,false,,N/A
yyv2rlZa3Nw,Which of the animals like hugs? #animalsofyoutube #animals #awesomeanimals,,TyAmongAnimals,,,"['https://en.wikipedia.org/wiki/Lifestyle_(sociology)', 'https://en.wikipedia.org/wiki/Pet']",,,149156092,14107,false,,N/A
C_w38ny3j4I,Nature&#39;s Beautiful Animal Evolution #animaljourney #animaltransformation #beautifulnature,Support The Channel Following us On https://www.instagram.com/danaanimalshorts/ Nature's Beautiful Animal Evolution: Pet to ...,Boldyz,,,['https://en.wikipedia.org/wiki/Pet'],,,146744118,3053,false,,N/A
JcwrTBRkJOs,Knowledge vs Money? With Cartoon Cow vs Tiger What Do Choose? #Shorts #Cartoon #Viral #shortsfeed,Knowledge vs Money? With Cartoon Cow vs Tiger What Do Choose? #Shorts #Cartoon #Viral #shortsfeed Ever wonder if brains ...,Zoro Animals Home,,,['https://en.wikipedia.org/wiki/Video_game_culture'],,,141973868,2356,false,,N/A
dXIyMS61B68,"Beautiful Relaxing Peaceful Music, Calm Music 24/7, &quot;Tropical Shores&quot; By Tim Janis","Beautiful Relaxing Peaceful Music, Calm Music 24/7, ""Tropical Shores"" By Tim Janis. My instrumental music can help you find ...",Tim Janis,,,"['https://en.wikipedia.org/wiki/Christian_music', 'https://en.wikipedia.org/wiki/Music']",,,127806018,0,false,,N/A
N_FrWkyrnHM,Animal Dance Song - Farm Animals Cartoon for Kids | Super Sumo Nursery Rhymes &amp; Kid Song,Animal Dance Song - Farm Animals Cartoon for Kids | Super Sumo Nursery Rhymes & Kid Song ...,Super Sumo,,,['https://en.wikipedia.org/wiki/Music'],,,126572887,0,false,,N/A
j0gffv9RkJ4,Animal Transformation. Before &amp; After! ✨😎 #shorts #animals,"This video is primarily for entertainment purposes. No copyright infringement is intended. For any concerns or inquiries, please ...",Purrfectia,,,['https://en.wikipedia.org/wiki/Entertainment'],,,118413227,1306,false,,N/A
oRGhqUjWF6U,ANIMAL: Abrar’s Entry - Jamal Kudu (Lyrical Video) | Bobby Deol | Sandeep Vanga | Bhushan Kumar,"Presenting The Lyrical Video Of The Widely Accepted Song ""Abrar's Entry - Jamal Kudu"" From The Highly Anticipated Film Animal ...",T-Series,,,"['https://en.wikipedia.org/wiki/Film', 'https://en.wikipedia.org/wiki/Music', 'https://en.wikipedia.org/wiki/Music_of_Asia']",,,117108023,13372,false,,N/A
p4AGbTnsxs8,#Funny #Animals 😹,Here we have some funny cats and dog fails! part 2 ⬇⬇⬇⬇More Panda⬇⬇⬇⬇   https://linktr.ee/Panda___ (social media) ...,Panda Shorts,,,"['https://en.wikipedia.org/wiki/Entertainment', 'https://en.wikipedia.org/wiki/Humour', 'https://en.wikipedia.org/wiki/Pet']",,,116425497,6180,false,,N/A
N4bFqW_eu2I,The Animals - House Of The Rising Sun (Music Video) [4K HD],The Animals House Of The Rising Sun Music Video from 1964 in stunning 4K HD for the first time. Listen to our Top 60s Hits ...,Timeless Music,,,"['https://en.wikipedia.org/wiki/Independent_music', 'https://en.wikipedia.org/wiki/Music', 'https://en.wikipedia.org/wiki/Pop_music', 'https://en.wikipedia.org/wiki/Rhythm_and_blues', 'https://en.wikipedia.org/wiki/Rock_music', 'https://en.wikipedia.org/wiki/Soul_music']",,,107170712,25495,true,,N/A
g3M4P9WQUCU,Animals&#39; Warning Signals to Humans&quot; #animals #rescue #dog,"Animals' Warning Signals to Humans"" - Generative A.I. Creator: Happy Explorer.",Happy Explorer,,,['https://en.wikipedia.org/wiki/Pet'],,,107373068,26835,false,,N/A
2lU0nu68Smk,Животные звучат песни | Потешки для малышей | Learn Animals | Kids Learning | Animal Sound Song,"Животное звук песня 'песня для детей, описывающих звуки, которые животные делают. 'Приходят мычание вместе !",Kids Tv Preschool Learning Russia,,,['https://en.wikipedia.org/wiki/Music'],,,97581496,0,false,,N/A
mPy7thVWBvU,"Black Panther vs White Animals (Lion, Tiger, Wolf)",animal #animals #tiger #lion #wolf #blackpanther #polarbear #leopard.,Versus Zoo,,,"['https://en.wikipedia.org/wiki/Entertainment', 'https://en.wikipedia.org/wiki/Film']",,,92952592,6670,false,,N/A
rfTgO9rpqck,Glass Animals - Heat Waves,Glass Animals - Heat Waves » Descargar: » Apoyo Glass Animals: https://www.instagram.com/glassanimals ...,LatinHype,,,"['https://en.wikipedia.org/wiki/Electronic_music', 'https://en.wikipedia.org/wiki/Independent_music', 'https://en.wikipedia.org/wiki/Music', 'https://en.wikipedia.org/wiki/Pop_music']",,,92772817,28722,false,,N/A
sdlre6kPy1E,Before &amp; After Animals Growing Up. Amazing Animal Transformation 💥 #short #tiktok #animals,Before & After Animals Growing Up. Amazing Animal Transformation #short #tiktok #animals #PetTransformation #PetJourney ...,Mr Aquarium🐟,,,"['https://en.wikipedia.org/wiki/Entertainment', 'https://en.wikipedia.org/wiki/Pet']",,,87907302,1941,false,,N/A
6ATbwi4kJ0w,Animals for Kids 25 min Farm animal sound,"Farm animal sounds. 25 min Farm animals for kids. Learn Farm animals. In this video for children, you can see a lot of animals.",My Little Star English,,,['https://en.wikipedia.org/wiki/Entertainment'],,,87484102,0,false,,N/A
ydYDqZQpim8,Namibia: Live stream in the Namib Desert,"Live feed, from a waterhole in the heart of Namibia Complementing the magnificence of the Namib Desert's never-ending red ...",NamibiaCam,,,[],,,84041667,0,false,,N/A
el7jytRPq4o,Wild Zoo Animals Toys - Baby and Mom Learn Animals Names - Educational Toys for Kids,Learn animals names with our educational sea and wild animal toys! Listen to the name of each animal as it shown and practice ...,Strawberry Jam Toys,,,"['https://en.wikipedia.org/wiki/Hobby', 'https://en.wikipedia.org/wiki/Lifestyle_(sociology)']",,,84027844,0,false,,N/A
DLC5ApDXUfs,Animal Transformation. Before &amp; After! 😎✨ #shorts #animals #animaltransformation,"Get ready to be amazed by these incredible animal transformations! From cute puppies to majestic lions, watch these animals ...",Pet Fix,,,"['https://en.wikipedia.org/wiki/Entertainment', 'https://en.wikipedia.org/wiki/Pet']",,,79351345,588,false,,N/A
wv7XUzlVi3Y,ANIMAL: ABRAR’S ENTRY - JAMAL KUDU | BOBBY DEOL | SANDEEP VANGA | BHUSHAN KUMAR,"PRESENTING THE MOST AWAITED FULL AUDIO SONG ""ABRAR'S ENTRY - JAMAL KUDU"" FROM THE HIGHLY ANTICIPATED ...",T-Series,,,['https://en.wikipedia.org/wiki/Music'],,,76877134,24410,false,,N/A
Kw1TCQT8_44,Playmobil 1-2-3 Animals Zoo and Aquarium Playset  Plus Extra Animal Figures,"Today, we are going to show you this fun Playmobil 1-2-3 Take-Along Animals Zoo and Aquarium Playset. In this video, we ...",RaceToyTime,,,"['https://en.wikipedia.org/wiki/Hobby', 'https://en.wikipedia.org/wiki/Lifestyle_(sociology)']",,,74713818,0,true,,N/A
5FwrgDl4QJE,Baa Baa Black Sheep Song - More Nursery Rhymes &amp; Kids Songs - Fun Cartoons For Kids,Baa Baa Black Sheep Song - More Nursery Rhymes & Kids Songs - Fun Cartoons For Kids.,Little monkey Nursery Rhymes and Kids Songs,,,['https://en.wikipedia.org/wiki/Music'],,,72671005,0,false,,N/A
vybRH6weB8U,Think of stray animals 😔,Think of stray animals.,DSP Shorts,,,"['https://en.wikipedia.org/wiki/Lifestyle_(sociology)', 'https://en.wikipedia.org/wiki/Pet']",,,71891960,711,false,,N/A
c6pNvSvjwbg,How Many Animals?! #kidsfun,Welcome to J House - an imperfect family working together towards a happy home filled with love and meaningful connections.,J House jr.,,,['https://en.wikipedia.org/wiki/Lifestyle_(sociology)'],,,71400185,0,false,,N/A
RcTLBsXvzQk,Most Dangerous Animals!,we find out what is the most dangerous animal in the world! CHECK OUT THESE CHANNELS OR ELSE Kai Banks ...,Beast Reacts,,,[],,,65965958,8366,true,,N/A
QAL2ttfsYro,Cute Wild animal bobak marmot or prairie dog eating cookies yummy 40,"Cute Wild animal bobak marmot or prairie dog eating cookies yummy. The bobak marmot or prairie dog (Marmota bobak), also ...",The Bobak Marmot,,,['https://en.wikipedia.org/wiki/Lifestyle_(sociology)'],,,63724705,11424,false,,N/A
XSqVlLT1t_Q,"If you laugh, you restart, part 29 #animals #funnyanimals",,Life is fun!,,,"['https://en.wikipedia.org/wiki/Entertainment', 'https://en.wikipedia.org/wiki/Humour', 'https://en.wikipedia.org/wiki/Pet']",,,62051680,5695,false,,N/A
a5-tjIB9YBk,ANIMALS - MAROON 5 (LYRICS),"ANIMALS ""Animals"" Baby, I'm preying on you tonight Hunt you down eat you alive Just like animals Animals Like animals Maybe ...",Robert Van,,,"['https://en.wikipedia.org/wiki/Music', 'https://en.wikipedia.org/wiki/Pop_music']",,,61760174,12626,false,,N/A
3r2TT1NpeUI,HOW DIFFERENT ANIMALS YAWN #shorts,shorts.,DNZio Shorts,,,['https://en.wikipedia.org/wiki/Entertainment'],,,61018941,20452,false,,N/A
YfDhHUuGMuo,Alvaro Soler - Animal (Official Music Video),Stream or Download Animal: https://AlvaroSoler.lnk.to/Animal_YD Eterno Agosto. Out Now: ...,AlvaroSolerVEVO,,,"['https://en.wikipedia.org/wiki/Electronic_music', 'https://en.wikipedia.org/wiki/Music', 'https://en.wikipedia.org/wiki/Music_of_Latin_America', 'https://en.wikipedia.org/wiki/Pop_music']",,,58643517,14452,false,,N/A
CUUnGQ2fz9w,"Cute little animals - Dog, cat, chicken, elephant, cow, tortoise - Animal sounds","Animals around us always have extremely cute moments, especially when they childhood. The puppy loves people, the sound of ...",Animal Moments,,,"['https://en.wikipedia.org/wiki/Lifestyle_(sociology)', 'https://en.wikipedia.org/wiki/Pet']",,,58383640,4060,false,,N/A
qIMkwXS7__c,Ouch!! But Bibib save my life!! #animals #funnyvideo #cute #funny #owl #pets #cuteanimals #funnypets,Bibib save my life!! Bibib can help with the choking.,Bibib Family,,,"['https://en.wikipedia.org/wiki/Entertainment', 'https://en.wikipedia.org/wiki/Pet']",,,57447160,1334,false,,N/A
pftlDBXzen8,This monkey is very angry！#animals,"The video features a Chinese monkey show, a performance with a history of 2000 years in China. The conflict between the human ...",Amazing China,,,['https://en.wikipedia.org/wiki/Entertainment'],,,57348170,903,false,,N/A
RCEp7A2WuQo,Crying little otter 🦦 #rescue #animals #shortvideo #cute,,Animal salvation ,,,['https://en.wikipedia.org/wiki/Pet'],,,56798180,11789,false,,N/A
PjVGdjh_ibQ,"Paint Animals Duck,Tiger,Cow,Lion,Buffalo,Gorilla,Elephant,Dinosaur Fountain Crossing Animal Game Ne","Paint Animals Duck,Tiger,Cow,Lion,Buffalo,Gorilla,Elephant,Dinosaur Fountain Crossing Animal Game New Paint Animals Cow ...",Mammoth Animal Fights,,,['https://en.wikipedia.org/wiki/Video_game_culture'],,,56275858,1337,false,,N/A
MrTKTwhsS8E,Praying Mantis vs Scorpion #insects  #mantis #scorpion #animals,The praying mantis is trying to catch a scorpion. But the scorpion fights back and stings the mantis. Hi. This video has over 41 ...,Insectinator,,,"['https://en.wikipedia.org/wiki/Entertainment', 'https://en.wikipedia.org/wiki/Film']",,,56535747,5506,false,,N/A
oZ7XuqSvS60,Fun Barnyard Farm Animals and Horse Figurines - Let&#39;s make a farm!,"Please subscribe to our channel if you haven't already done so. Like, share, and comment on our video. And, as always, thanks ...",RaceToyTime,,,"['https://en.wikipedia.org/wiki/Hobby', 'https://en.wikipedia.org/wiki/Lifestyle_(sociology)']",,,54568623,0,false,,N/A
YtDO_W6JpAU,शुभ कछुआ को मिली एक नई ज़िंदगी 🙏 #animal #animals #animallover #animalrescue #turtle,"I upload videos related to animal rescue in my channel. My only aim is that you all watch my video completely, like it and help all ...",WildlifeRescueTV,,,['https://en.wikipedia.org/wiki/Pet'],,,53411142,2315,false,,N/A
Q9JJyfnbY6g,"Animals for Kids to Learn - 100 Animals for Kids, Toddlers and Babies in English | Educational Video","Animals for Kids to Learn. Here is an educational video of 100 Animals for kids, toddlers and babies in English.Subscribe to ...",Kiddopedia,,,[],,,51484263,0,true,,N/A
5DF9aRuiOZo,Animals,Provided to YouTube by Universal Music Group Animals · Maroon 5 V ℗ 2014 Interscope Records Released on: 2015-05-18 ...,Maroon 5 - Topic,,,"['https://en.wikipedia.org/wiki/Music', 'https://en.wikipedia.org/wiki/Pop_music', 'https://en.wikipedia.org/wiki/Rock_music']",,,50480497,589,false,,N/A
WhwaFXlHJb8,If animals did Parkour. Part 3,"How different animals would do Parkour/Flips. Part3 #shorts #Parkour #animals Shoutout to the ""21"" channel members: ⭐JaviSan ...",Jiemba Sands,,,['https://en.wikipedia.org/wiki/Entertainment'],,,50351415,561,false,,N/A
GM0o9BeZ65U,Real Duck - The Animals Around Us,Real Duck - The Animals Around Us #duck #ducks #animals.,The Animals Around Us,,,"['https://en.wikipedia.org/wiki/Hobby', 'https://en.wikipedia.org/wiki/Lifestyle_(sociology)']",,,50259375,0,false,,N/A
GeQzAMyXJwg,Top 3 Favourite Animals,factsmine #mustafa #facts #viral #trending #fact #knowledge #latest.,Facts' Mine,,,"['https://en.wikipedia.org/wiki/Entertainment', 'https://en.wikipedia.org/wiki/Film']",,,48380003,7690,false,,N/A
h2cMPIXA5Ts,How food aggressive are the animals? #animalsofyoutube #coolanimals #animals #amonganimals,,TyAmongAnimals,,,['https://en.wikipedia.org/wiki/Lifestyle_(sociology)'],,,47806219,6835,false,,N/A
z6EchXyieos,Funniest Animals 🐧 - Best Of The 2020 Funny Animal Videos 😁 - Cutest Animals Ever,Funniest Dogs And Cats - Don't try to hold back Laughter ---------------------------Welcome to the Funniest Animals Ever!,Funniest Animals Ever,,,"['https://en.wikipedia.org/wiki/Humour', 'https://en.wikipedia.org/wiki/Lifestyle_(sociology)', 'https://en.wikipedia.org/wiki/Pet']",,,46337202,9971,false,,N/A
vPRd2SDfpPw,Animal lover 🥺🫶🏻❤️ #shorts #animals,,Amishaforyou,,,['https://en.wikipedia.org/wiki/Entertainment'],,,46021300,3627,false,,N/A
ZZbTlgfa2Dg,"Mammoth vs Animals vs Dinosaurs (T.Rex, Lion, Tiger)",animals #animal #dinosaurs #dinosaur #mammoth #trex #tyrannosaurusrex #lion #tiger #spinosaurus.,Versus Zoo,,,['https://en.wikipedia.org/wiki/Entertainment'],,,45974927,2306,false,,N/A
pTrC_McU62Q,Animal Sounds for Kids - 34 amazing animals,https://www.instagram.com/lego.isart/p/C5LRs5Et-1d/ Animal Sounds. Learning Animals Names and Sounds for children / kids.,KidsTV,,,[],,,44627112,0,false,,N/A
eIpLAwON_R4,Martin Garrix - Animals (Bass Boosted),,BASS BOOSTED SONGS,,,"['https://en.wikipedia.org/wiki/Electronic_music', 'https://en.wikipedia.org/wiki/Music', 'https://en.wikipedia.org/wiki/Pop_music']",,,44387804,6348,false,,N/A
e6o3HOEXeVk,Before &amp; After Animals Growing Up. ohhh !!!! #viral #animals #shorts,Before & After Animals Growing Up. ohhh.,Viral Animal,,,['https://en.wikipedia.org/wiki/Entertainment'],,,44336425,926,false,,N/A
rYJMIpQps8Y,Animals Choose The Right Key With Cow Mammoth Elephant Gorilla Lion Tiger Wild Animals Matching Game,Animals Choose The Right Key With Cow Mammoth Elephant Gorilla Lion Tiger Wild Animals Matching Game ...,Animals Kingdom Tv,,,"['https://en.wikipedia.org/wiki/Simulation_video_game', 'https://en.wikipedia.org/wiki/Video_game_culture']",,,44611282,0,false,,N/A
nETqLL-SUoA,How different animals take fall damage. Part 2,A short comedy skit about how diiferent animals deal fall damage. Part 2 #shorts #Physicalcomedy #animals My other socials: ...,Jiemba Sands,,,['https://en.wikipedia.org/wiki/Video_game_culture'],,,43580491,840,false,,N/A
EOe7lJRYKdE,The fastest creature on land #trending #animals #lion #horse #cheetah #springbok #viralvideo #short,"the fastest creature on land, this video is made only as much as entertainment, this is not real, the fastest on land remains a ...",Rendi goodboy,,,['https://en.wikipedia.org/wiki/Entertainment'],,,43358457,3763,false,,N/A
Z452xt_QKF0,Hyena Welcome🥰 #deanschneider #wildlife #animals,Who is also always so excited to see you?,Dean Schneider,,,['https://en.wikipedia.org/wiki/Entertainment'],,,42529909,25789,false,,N/A
B5ek16IGAEA,अब तो बंदर नही बच पाएगा 😭🙏 #animal #animals #animallover #animalrescue #monkey,अब तो बंदर नही बच पाएगा This story highlights How a great man brought an injured monkey back to life. Friends ...,World hub 2.0,,,[],,,41568512,8611,false,,N/A
60g7D6QF1xM,Animals Reunited With Owners After Years !,"If your pet's eyes fill with sadness just from you going to work, then imagine what it's like for animals that have been separated ...",MAD LAB,,,"['https://en.wikipedia.org/wiki/Entertainment', 'https://en.wikipedia.org/wiki/Film', 'https://en.wikipedia.org/wiki/Pet']",,,41411582,11843,false,,N/A
