Video ID,Title,Description,Channel Title,Keyword Tags,YouTube Video Category,Topic Details,Video Published at,Video Duration,View Count,Comment Count,Captions Available,Caption Text,Location
5g2GZednU60,Animals for children  Learn the names and sounds of animals,"Learn the names and sounds of wild animals. Owl, camel, llama, marmot and more. The video was created specifically for the ...",My Little Star English,,,['https://en.wikipedia.org/wiki/Knowledge'],,,3512579,0,false,,N/A
hKjjBq1wkNk,"Mammoth vs Animals vs Dinosaurs (T.Rex, Lion, Tiger)",animals #animal #dinosaurs #dinosaur #mammoth #trex #tyrannosaurusrex #lion #tiger #spinosaurus.,Animal Versus Creations,,,"['https://en.wikipedia.org/wiki/Entertainment', 'https://en.wikipedia.org/wiki/Film']",,,3451147,104,false,,N/A
07tI3uGWhGg,Maroon 5 - Animals [Tradução/Legendado],Ficha Técnica|--- Música: Animals Produção: Maroon 5 ------------------------------- ➥Servidor EletroCity: https://discord.gg/eletrocity ...,Nikko,,,"['https://en.wikipedia.org/wiki/Music', 'https://en.wikipedia.org/wiki/Pop_music']",,,3441809,1925,true,,N/A
kM67wASvgso,Toddler Learning Video - Create Animals and Fruits With Fun Play Doh 🍓🐘,Welcome to the world of fun learning! Did you know that watching colorful and educational videos can have a tremendous positive ...,Emily's Playhouse - Learning Videos for Kids,,,"['https://en.wikipedia.org/wiki/Hobby', 'https://en.wikipedia.org/wiki/Lifestyle_(sociology)']",,,3383336,0,false,,N/A
fLJKPhqwxKE,Mansi ke pass Lion🦁 hai #shorts #lion #animals #funny,today trending shorts indian forest animals or sisters funny prank comedy video village family mini vlog #trending #shortvideos ...,Ranwa Family,,,['https://en.wikipedia.org/wiki/Entertainment'],,,3373168,15,false,,N/A
L2IjgBtZmHU,Opposite Animals Mate? 😱,BECOME A MEMBER OF THE CHANNEL - https://bit.ly/SubtoMunson Join Discord https://discord.gg/RcV22WkWEW ⚫Follow ...,Munson Reacts,,,['https://en.wikipedia.org/wiki/Entertainment'],,,3343863,924,false,,N/A
ld8eLDdPLRs,"5 Giant Duck Cartoon, Paint &amp; Animals Lion, Gorilla, Bear,Tiger , Cow Wild Animals Crossing Fountain","fountaincrossing #cowcartoon #crossingfountain #cowsong #duckcartoon 5 Giant Duck Cartoon, Paint & Animals Lion, Gorilla, ...",Animals Home Animation,,,"['https://en.wikipedia.org/wiki/Entertainment', 'https://en.wikipedia.org/wiki/Film']",,,3354171,58,false,,N/A
VvNdnUfYDBI,Animal Transformation. Before &amp; After! ✨😍 #animals #beforeandafter,"This video is primarily for entertainment purposes. No copyright infringement is intended. For any concerns or inquiries, please ...",Purrfectia,,,[],,,3564371,10,false,,N/A
unrzNxBMFhs,Paint Animals Lion Tiger Gorilla Cow Elephant #shorts #paintanimals,"paint animals, gorilla, cow, tiger, lion, elephant, fountain crossing, animals, fountain crossing with gorilla, fountain crossing animal ...",Animal Kingdom,,,['https://en.wikipedia.org/wiki/Video_game_culture'],,,3276888,13,false,,N/A
TL5EyScV5gg,ANIMALS THAT ARE NEARLY EXTINCT #shorts,,Richard Sales Official,,,"['https://en.wikipedia.org/wiki/Entertainment', 'https://en.wikipedia.org/wiki/Film']",,,3236539,5182,false,,N/A
si6FLGyvxW8,Wild Animals for Kids | Wild Animals with Sounds | wild animals name |#animals #wildanimals #Educare,Wild Animals for Kids | Wild Animals with Sounds | wild animals name | animals name | animals with nams and sounds | #animals ...,Educare,,,['https://en.wikipedia.org/wiki/Knowledge'],,,3228679,0,false,,N/A
HWyUDFra65U,The Great Escape: Zombie Animals on the Run | Magical Animals Rescue Adventure!,"Watch The Great Escape: Zombie Animals on the Run | Magical Animals Rescue Adventure!. Join us for The Great Escape, where ...",Funny Animals TV,,,"['https://en.wikipedia.org/wiki/Entertainment', 'https://en.wikipedia.org/wiki/Film']",,,3233784,41,false,,N/A
2kpAzC2Mja8,Martin Garrix - Animals (Official Lyrics Video),"This song is the currently the biggest hit of Martin Garrix's career. It was released on June 17 2013, through his label Spinnin` ...",Khushal Kerai,,,"['https://en.wikipedia.org/wiki/Electronic_music', 'https://en.wikipedia.org/wiki/Music', 'https://en.wikipedia.org/wiki/Pop_music']",,,3182702,1093,false,,N/A
kwXOj3UcJ3I,Black cow vs white lion fight for baby #cow #lion #animals #babyanimal #feelings #motherslove,Black cow vs white lion fight for baby #cow #blackcow #cowcalf #calf #whitelion #lion #tiger #forest #babyanimal #greenfarm ...,ALPHA CLUB,,,[],,,3177284,80,false,,N/A
_FLYasyXIw8,"Black bull vs wild animals (leopard, bear, ram, fox, hyena) #blackbull #blackcow #wildanimals","Black bull vs wild animals (leopard, bear, ram, fox, hyena) #blackbull #blackcow #cow #ram #hyena #snowleopard #leopard ...",ALPHA CLUB,,,[],,,3170136,94,false,,N/A
kbR5O1DVZKw,"Amazing Animal Growth Journey of Tiger, Rhino and Cow!",Amazing Animal Growth Journey: See the incredible metamorphosis of a tiny pet into a powerful creature. This brief film illustrates ...,Pawsome Moments ,,,['https://en.wikipedia.org/wiki/Pet'],,,3178978,42,false,,N/A
ketQamS39mk,Werenoi - Animal (Visualizer),"Werenoi - Animal (Visualizer) Nouvel album ""Pyramide"" disponible : https://werenoi.bfan.link/pyramide Abonne-toi ...",Werenoi,,,"['https://en.wikipedia.org/wiki/Electronic_music', 'https://en.wikipedia.org/wiki/Hip_hop_music', 'https://en.wikipedia.org/wiki/Music']",,,3134600,255,false,,N/A
FyELCKolfgI,cow comedy video #funny cow #cow sound #funny clips #cow video,,Animals short clip ,,,['https://en.wikipedia.org/wiki/Entertainment'],,,3098097,0,false,,N/A
Krh9ccPOx-M,African Safari 4K • Wildlife Relaxation Film with Peaceful Relaxing Music and Animals Video Ultra HD,"Wildlife Animals on Safari. To make this video, I bought a Tamron 50-400mm lens to be able to film animals like lions‚ rhinos‚ ...",Relaxation Film,,,"['https://en.wikipedia.org/wiki/Lifestyle_(sociology)', 'https://en.wikipedia.org/wiki/Tourism']",,,3013433,226,false,,N/A
EAb2VKtrk6c,Islands Do Strange Things To Animals | SCIENCE MINUTE,"Scientists have noticed the same thing happens to different species as they evolve to island life. What is the Island Effect, and ...",Mission Unstoppable,,,['https://en.wikipedia.org/wiki/Knowledge'],,,3027012,853,false,,N/A
tSP2RblJhS4,Pitbull Dog vs Animals &amp; jurassic World #animalbattle,Pitbull Dog vs Animals & jurassic World #animalbattle.,Marvelengers,,,"['https://en.wikipedia.org/wiki/Entertainment', 'https://en.wikipedia.org/wiki/Film']",,,3014875,596,false,,N/A
nnjXKnsPOGs,Baby Animals 4K (60FPS) - Mischievous Moments With Baby Animals And Relaxing Music,"4kvideo #babyanimals #relaxing Welcome to our YouTube channel! Today, we would like to introduce a special video where you ...",4K Animals Relaxation,,,"['https://en.wikipedia.org/wiki/Lifestyle_(sociology)', 'https://en.wikipedia.org/wiki/Pet']",,,2977459,187,true,,N/A
t6OPuV37sE0,Old Macdonald Had A Farm | Baby Animals For Kids | Meeko&#39;s Family Classic Nursery Rhymes,"Meeko loves to go to the farm, play with the sheep, the cow, the ducks and all the cute animals! Let's meet Old MacDonald and ...",HooplaKidz - Official Nursery Rhymes Channel,,,"['https://en.wikipedia.org/wiki/Entertainment', 'https://en.wikipedia.org/wiki/Film']",,,2912928,0,false,,N/A
T9mAbKqBT5Q,ANIMALS OF AMAZON RAINFOREST 8K Ultra HD – Jungle Wildlife and Sounds,ANIMALS OF AMAZON RAINFOREST 8K Ultra HD – Jungle Wildlife and Sounds #8k #animals #amazon You are invited to see ...,8K VIDEOS HDR,,,"['https://en.wikipedia.org/wiki/Lifestyle_(sociology)', 'https://en.wikipedia.org/wiki/Tourism']",,,2923298,374,false,,N/A
yhWOlzb9DPk,cute mini animalis 2 #animals #cute #baby #shorts,,cute animals,,,['https://en.wikipedia.org/wiki/Entertainment'],,,2915505,66,false,,N/A
Ncr40MKeJn4,Zoo Animals Great Escape Adventure - Lion Tiger Elephant Monkey Fox Deer Giraffe Animal Cartoons,Watch Zoo Animals Great Escape Adventure - Lion Tiger Elephant Monkey Fox Deer Giraffe Animal Cartoons. #zooanimals ...,Funny Animals TV,,,"['https://en.wikipedia.org/wiki/Entertainment', 'https://en.wikipedia.org/wiki/Film']",,,2854534,22,false,,N/A
HpWpRWG3EOg,fastest animal on land ocean and sky #trending #animals #cheetah #blackmarlin#peregrinefalcon#shorts,,Rendi goodboy,,,[],,,2833327,262,false,,N/A
KQt3jVyME-k,"Wild animals, farm animals and aquatic animals for kids - Vocabulary for kids","Educational video for kids to learn new vocabulary, wild animals, farm animals and aquatic animals like the seal, the dolphin, the ...",Smile and Learn - English,,,['https://en.wikipedia.org/wiki/Knowledge'],,,2727946,0,false,,N/A
UQVlVM0TLcg,CROC 🐊 EATS HIS HAND! 🤚 😱 #animal #animals #comedy #funny #lol,,Nicolas Roman,,,"['https://en.wikipedia.org/wiki/Entertainment', 'https://en.wikipedia.org/wiki/Humour']",,,2721898,489,false,,N/A
zOByKMhQsak,"This Animal Can Survive 15,000 Years! 🤯","BECOME A MEMBER OF THE CHANNEL - bit.ly/SubToMunsonReacts ❤ USE CREATOR CODE: ""TRUCK"" IN THE FORTNITE ...",Munson Reacts,,,['https://en.wikipedia.org/wiki/Entertainment'],,,2695104,561,false,,N/A
ziQuHzoGJtA,impossible to see them💀 #edit #animals #animalshorts #animal #camouflage #invisible,,h6itam,,,"['https://en.wikipedia.org/wiki/Entertainment', 'https://en.wikipedia.org/wiki/Film']",,,2660615,247,false,,N/A
6iItBGJnlGs,Golden Eagle vs Forest animals,animals #wildlife #eagle #eagles #animal #owl #wolf.,WB,,,[],,,2648287,97,false,,N/A
y6N8u4OGgXk,BABY ANIMALS 4K HDR | with Cinematic Sound (Colorful Animal Life),BABY ANIMALS 4K HDR | with Cinematic Sound (Colorful Animal Life) BABY ANIMALS 4K HDR | with Cinematic Sound (Colorful ...,12K UHD WORLD,,,[],,,2652137,143,false,,N/A
r7WG9tWHiuI,A Cat City #shorts #animals #cat #cute #funny,,Animals_2222,,,"['https://en.wikipedia.org/wiki/Entertainment', 'https://en.wikipedia.org/wiki/Pet']",,,2663485,3211,false,,N/A
E-x3kIN0X0g,Animal BEST Friends | 1 Hour of FUNNY Pets 😍,"Enjoy over an hour of these animal BFFs ♥️ Dogs, Cats, Birds and Lizards. ✨    Subscribe to The Scoop for our most ...",The Pet Collective,,,"['https://en.wikipedia.org/wiki/Lifestyle_(sociology)', 'https://en.wikipedia.org/wiki/Pet']",,,2593100,245,false,,N/A
raUf_psggpY,How did Smilodon become extinct from the earth#science #sciencefacts #sabertoothtiger,How did Smilodon become extinct from the earth #science #sciencefacts #sabertoothtiger How did Smilodon become extinct from ...,Scienceverse,,,['https://en.wikipedia.org/wiki/Knowledge'],,,2571382,361,false,,N/A
sWKLbXYcwS8,Lion vs leopard #wildlife #trending #animals #lion #leopard #shorts,,Rendi goodboy,,,[],,,2725587,560,false,,N/A
WI_iEVEA-Jw,"Pregnant Lion, Cunning Hunter | Forest Animals Saves Pregnant Lion From Hunter",Watch The Cunning Hunter's: Pregnant Lion Story | Forest Animals Saves Pregnant Lion From Hunter! #Cunninghunter ...,Funny Animals TV,,,"['https://en.wikipedia.org/wiki/Entertainment', 'https://en.wikipedia.org/wiki/Film']",,,2502432,77,false,,N/A
1yNrrJQfQjk,This dangerous animal was so close to kids! #shorts #animals,SUBSCRIBE - http://bit.ly/subscribebondirescue Join the Bondi Rescue Community https://bit.ly/JointheBRCommunity Buy ...,BondiRescue,,,"['https://en.wikipedia.org/wiki/Lifestyle_(sociology)', 'https://en.wikipedia.org/wiki/Television_program']",,,2492920,426,false,,N/A
wSUOt2Mzhug,SkinWalker Disguised As Animals PRT-07 ☢️ #viral,,Scary Things,,,"['https://en.wikipedia.org/wiki/Entertainment', 'https://en.wikipedia.org/wiki/Pet']",,,2477709,724,false,,N/A
CROqA8Jw5pw,It so ugly #gorilla #baby #animals #cute #monkey #funny #animallover #gorillagorilla,,Healala TV,,,['https://en.wikipedia.org/wiki/Entertainment'],,,2502602,44,false,,N/A
wo-9ObNFDdo,ARBS Prehistoric Mammals vs ARK Prehistoric Animals vs Dinosaur Animal Revolt Battle Simulator,ARBS Prehistoric Mammals vs ARK Prehistoric Animals vs Dinosaur Animal Revolt Battle Simulator wild animals ...,Super Doodle Tv,,,['https://en.wikipedia.org/wiki/Video_game_culture'],,,2475044,61,false,,N/A
_Io6V8Eo0Lo,"Hippo vs Black Panther White Animals Battle (Lion, Tiger, Wolf)",animal #animals #hippo #blackpanther #hyena #lion #wolf #pinkpanther #polarbear #leopared #blackleopard #blackpanther ...,DIM VIRAL ,,,"['https://en.wikipedia.org/wiki/Entertainment', 'https://en.wikipedia.org/wiki/Film']",,,2463824,155,false,,N/A
JnaseAj1kME,Animal Planet 4K - Scenic Wildlife Film With Inspiring Music,Our planet is full of amazing animals! Enjoy this 4K Scenic Wildlife film featuring the vast animal species that inhabit our world.,Scenic Relaxation,,,"['https://en.wikipedia.org/wiki/Entertainment', 'https://en.wikipedia.org/wiki/Film']",,,2444220,225,false,,N/A
B0vkQUXZ4V8,Doberman pinscher dog vs Animals and Jurassic World #animalbattle,Doberman pinscher dog vs Animals and Jurassic World #animalbattle.,Marvelengers,,,['https://en.wikipedia.org/wiki/Entertainment'],,,2457567,477,false,,N/A
ZFIyXBeI4dI,New Animals That Got Discovered in 2024 🤔,New Animals Discovered in 2024 Socials: Twitter ➜ https://twitter.com/hxsain Instagram ...,hxsain,,,['https://en.wikipedia.org/wiki/Entertainment'],,,2419541,2558,false,,N/A
UelD3g-wHj0,Baby King Learns Farm Animals for Kids | Educational Animal Videos by Papa Joel’s English,"The Little Knight and the baby King go to the farm and to learn about all the animals. Suddenly, while reading our farm animal ...",Papa Joel's English,,,['https://en.wikipedia.org/wiki/Entertainment'],,,2536155,0,false,,N/A
iPAvbLf9bDQ,"Baby Horse, Trot Trot | Baby Animals Songs | Pinkfong for Kids","You're watching ""Baby Horse, Trot Trot!"", an educational and interactive series prepared to you by Pinkfong! Subscribe Pinkfong ...",Baby Shark - Pinkfong Kids’ Songs & Stories,,,['https://en.wikipedia.org/wiki/Music'],,,2436763,0,false,,N/A
c4piy-kUc6A,I rescued a turtle! 🐢 #turtle #pets #animals,,Indian Pet Keeper,,,['https://en.wikipedia.org/wiki/Pet'],,,2356448,205,false,,N/A
3dt0OrHzgok,CUTE ANIMALS Playing in Water 4K(60FPS) |  Relax with JAZZ MUSIC - STREAM FOREST Sound,CUTE ANIMALS Playing in Water 4K(60FPS) | Relax with JAZZ MUSIC - STREAM FOREST Sound #MelodyAnimals #cuteanimals ...,CutiePieces - Relaxation,,,['https://en.wikipedia.org/wiki/Lifestyle_(sociology)'],,,2319351,56,false,,N/A
eQfvphS6ceo,Elephant 🐘 short #video #shorts #funny #funnyanimal #elephant #animals #animalllover#youtubeshorts,Elephant short #video #shorts #funny #funnyanimal #elephant #animals #animalllover.,ANIMALS VIDEO 17,,,['https://en.wikipedia.org/wiki/Entertainment'],,,2339665,56,false,,N/A
waTqxh2Pv7U,Amazing Facts Animals Before and Now to be amazed,Animals before and after#zakifusion #dinosaur #dna #short #shorts #youtubeshorts #best #beamazed #extinction.,"ZAKI,,FUSION ",,,['https://en.wikipedia.org/wiki/Entertainment'],,,2286342,903,false,,N/A
ruAizup7dHw,20 Animals Name Hindi and english | जानवरों के नाम | Animals name,"20 Animals name hindi and english | जानवरों के नाम | animals name Hello Friends, This video is about animals name ...",Ideal Handwriting,,,['https://en.wikipedia.org/wiki/Knowledge'],,,2225365,596,false,,N/A
Kkb7EoHs-g8,Adorable Baby Tiger Moments!#tiger #animals#wildlife #cute #zoo #rare,"Subscribe Now Join the Cuteness Club! Explore the fluffiest moments with us. Watch & Relate Puppies, kittens, and ...",Furry Friends,,,['https://en.wikipedia.org/wiki/Entertainment'],,,2196077,241,false,,N/A
dQA8W4zFUU0,Adivina el Animal | Quiz Show de Animales | Canciones Infantiles | JunyTony en español,Juny y Tony jugana a adivinar el animal mirando solo el diseño de su pelaje. ¡Jueguemos juntos e intentemos adivinar!,JunyTony - Canciones Infantiles,,,"['https://en.wikipedia.org/wiki/Entertainment', 'https://en.wikipedia.org/wiki/Film']",,,2168089,0,false,,N/A
oUtnsFrdL2g,TigerLion Animals vs Animals Hybrid Animal Fusion AI #animalbattle #animalrevolbattle #youtubeshorts,,AiOrNature,,,"['https://en.wikipedia.org/wiki/Entertainment', 'https://en.wikipedia.org/wiki/Film']",,,2164107,391,false,,N/A
C3qHZk1VWFk,Puppies Meet Baby Animals,"We've partnered with Puppy Chow to bring you this video documenting a few of the more ""aw""-worthy firsts in a puppy's life.",HuffPost,,,"['https://en.wikipedia.org/wiki/Lifestyle_(sociology)', 'https://en.wikipedia.org/wiki/Pet']",,,2132911,2109,false,,N/A
DH89XAIRMmM,OCEAN ANIMAL ADVENTURES 60FPS 8K ULTRA HD,"This is YouTube 8K 60FPS with Ocean Animal Adventures, a stunning documentary showcasing the diverse and captivating 8K ...",8K VIDEOS ULTRA HD,,,[],,,2153199,142,false,,N/A
Rt-HbT5Jb2A,Baby With Animals Fashion Show Walk #viral #shorts #tiktok,Baby With Animals Fashion Show Walk #viral #shorts #tiktok.,Model Kids,,,['https://en.wikipedia.org/wiki/Entertainment'],,,2113181,248,false,,N/A
HEGzikUviwo,"GIANT OXES, GIANT HORSES AND OTHER FARM ANIMALS/BOIS GIGANTES, CAVALOS GIGANTES E OUTROS ANIMAIS",worldmarshall LET'S PLAY WITH OUR GIANT ANIMALS / VAMOS BRINCAR COM OS NOSSOS ANIMAIS GIGANTES.,World Marshall,,,"['https://en.wikipedia.org/wiki/Hobby', 'https://en.wikipedia.org/wiki/Lifestyle_(sociology)']",,,2088413,0,false,,N/A
3J6h4csOC9k,Wild animals | जंगली जानवरों के नाम | wild animals for kids | @aajadkidseducationalvideo,About this video- आज हम जंगली जानवरों के नाम सीखेंगे.,aajad kids educational video,,,['https://en.wikipedia.org/wiki/Knowledge'],,,2062897,0,false,,N/A
fpHDxym9Wzg,omer ke peanut kon le gya #animals #shorts #short #viralshorts #ytshorts,,omer babu21,,,['https://en.wikipedia.org/wiki/Entertainment'],,,2044036,3,false,,N/A
2xhmdzNZ820,Animals of Amazon 4K - Animals That Call The Jungle Home | Amazon Rainforest |Scenic Relaxation Film,Discover amazing wildlife of Amazon! In this scenic film you will see the most incredible wild animals and birds that call the jungle ...,Scenic Scenes,,,"['https://en.wikipedia.org/wiki/Film', 'https://en.wikipedia.org/wiki/Lifestyle_(sociology)', 'https://en.wikipedia.org/wiki/Tourism']",,,2010955,258,false,,N/A
Ok2LLcVE9oI,Most Ugliest Animals In The World🌍🐾 #shorts,Most Ugliest Animals In The World     #shorts #animals #uglyanimals #fish #creepy #viral.,Static Data,,,[],,,1982727,2340,false,,N/A
coXiercrD8c,Rescued a pregnant cow from muddy field #humanity #cow #cowlover #animals #petlover #rescueteam,Rescued a pregnant cow from muddy field @MohammadHussain-bp8nj #cow #cows #cowlover #indiancow #weakcow #helpcow ...,ALPHA CLUB,,,[],,,1999064,44,false,,N/A
NfkaggRL52Y,African Savanna 8K ULTRA HD | Wild Animals of African Safari | Relaxation Film,African Savanna 8K ULTRA HD | Wild Animals of African Safari | Relaxation Film https://youtu.be/NfkaggRL52Y African Savanna ...,8K Ultra,,,"['https://en.wikipedia.org/wiki/Film', 'https://en.wikipedia.org/wiki/Tourism']",,,1970069,94,false,,N/A
VV6Ss3YiPxE,Tree shrews are the only small animals that use toilets.#cute #animals,,Fur-tastic Moments ,,,[],,,1973147,1620,false,,N/A
tVjg4ohDqnI,If Different Animals Rode Bikes. Part 2,I short comedy skit about how different animals would ricycles. part 2 #animals #comedy #bikes My other socials: Linktree: ...,Jiemba Sands,,,"['https://en.wikipedia.org/wiki/Entertainment', 'https://en.wikipedia.org/wiki/Humour']",,,1945134,330,false,,N/A
uGwTfA2T52M,Animal Finding Adventure | EP47 | Animals at Home | Nursery Rhymes &amp; Kids Songs | LiaChaCha,Suddenly there are many animals at home. Let's take a look with Baby ChaCha and see which animals are here! LiaChaCha ...,LiaChaCha - Nursery Rhymes & Baby Songs,,,"['https://en.wikipedia.org/wiki/Entertainment', 'https://en.wikipedia.org/wiki/Film']",,,1994073,0,false,,N/A
gjRkRaWajyU,ANIMALS BEING BROUGHT BACK ? NO THANKS #shorts,,Richard Sales Official,,,['https://en.wikipedia.org/wiki/Lifestyle_(sociology)'],,,1992342,1078,false,,N/A
SoZcF4EpN0U,КУКУЛИ КУ МАВ 🐾🧸#cute #love #animals #duet #cat #part1,,Rustam 69,,,['https://en.wikipedia.org/wiki/Entertainment'],,,1904562,121,false,,N/A
SAseHtFWP6E,The little deer is stuck in the animal world. Fantastic animals are here. Highlights of the anim,The little deer is stuck in the animal world. Fantastic animals are here. Highlights of the anim.,Battle of Wild Animals,,,"['https://en.wikipedia.org/wiki/Entertainment', 'https://en.wikipedia.org/wiki/Film']",,,1886771,24,false,,N/A
Qg4aQUwtr5Q,Baby Animals - Amazing World Of Young Animals | 4K Scenic Relaxation Film (60FPS)🌿,Baby Animals - Amazing World Of Young Animals | 4K Scenic Relaxation Film (60FPS)   #MelodyAnimals #cuteanimals ...,CutiePieces - Relaxation,,,[],,,1867079,86,false,,N/A
Z6OibnLBVLg,Animal Battle Song | Animal songs | Nursery Rhymes | REDMON,"A fight among the animals! Curious, curious, I wonder who will win? A tiger and a lion meet for a fight For a fight! For a fight!",Redmon Kids! Songs & Stories,,,['https://en.wikipedia.org/wiki/Music'],,,1866935,0,false,,N/A
BWAnHej2vH8,The CUTEST Baby Animals On The Farm!  🐣 | John Deere Kids,"Whether they have fur or feathers, baby animals are just the cutest! And you can find so many different cute animal babies on a ...",John Deere Kids,,,"['https://en.wikipedia.org/wiki/Lifestyle_(sociology)', 'https://en.wikipedia.org/wiki/Pet']",,,1767790,0,false,,N/A
8No3g6aLF5E,Baby Animals 4K - Explore The Cute World Of Young Wild Animals With Relaxing Music (Colorfully),Welcome to Musical Feelings I want to bring you the best footage of the animal world that I have recorded in my journeys to ...,Musical Feelings,,,[],,,1749928,40,false,,N/A
KByzBDZ6bQA,30 Times When Animals Reunited With Owners After Years And Said  &quot;I Love You&quot; in a Special Way !,"Separation can be a nightmare for true friends, but finally being reunited is the most emotional and unforgettable gift. Today, we're ...",MAD LAB,,,"['https://en.wikipedia.org/wiki/Entertainment', 'https://en.wikipedia.org/wiki/Pet']",,,1739707,334,false,,N/A
0-ULTdNUtDo,🔴 LIVE: Wild Animals and the Fight for Survival | Savage Kingdom | S1 FULL EPISODES | Nat Geo,"Savage Kingdom | S1, E1-6 Leopard Rock - Saba the leopard fights to defend her cubs in the Savage Kingdom. The Pale Pack - A ...",Nat Geo Animals,,,"['https://en.wikipedia.org/wiki/Entertainment', 'https://en.wikipedia.org/wiki/Film', 'https://en.wikipedia.org/wiki/Television_program']",,,1696784,0,false,,N/A
Mhd6qgNVG5E,Cute Baby Animal Sounds #cute #animal #babyanimals #adorable #funnysounds,,Fur Funny,,,['https://en.wikipedia.org/wiki/Entertainment'],,,2113453,195,false,,N/A
Tx2lR1CH2Zs,"5 Giant Duck Cartoon,Cow,Elephant,Tiger,Lion,Dinosaur,Paint Wild Animals Crossing Fountain Animation",5giantduckcartoon #animalscrossingfountain #giantduck #animalscartoon #giantduck #animalscrossing 5 Giant Duck Cartoon ...,Animal Kingdom,,,"['https://en.wikipedia.org/wiki/Entertainment', 'https://en.wikipedia.org/wiki/Film']",,,1731458,589,false,,N/A
G9VZbA5PZ2g,#shorts #shortsvideo #rescue #animals #animalshorts #animalsvideo #bird,,Lshmi Powell,,,"['https://en.wikipedia.org/wiki/Entertainment', 'https://en.wikipedia.org/wiki/Pet']",,,1667995,563,false,,N/A
Dp0TFw0VuCU,King Monkey&#39;s Magical Reign: Wild Animals Turn into Servants | Funny Animal Kingdom!,Watch King Monkey's Magical Reign: Wild Animals Turn into Servants | Funny Animal Kingdom! Welcome to the Magical Monkey ...,Fat Animals TV,,,"['https://en.wikipedia.org/wiki/Entertainment', 'https://en.wikipedia.org/wiki/Film', 'https://en.wikipedia.org/wiki/Humour', 'https://en.wikipedia.org/wiki/Television_program']",,,1686702,27,false,,N/A
Hlq8RL47XkU,Fake Chinese Zoo animals,https://Davidzhang.net My social media: Instagram: https://www.instagram.com/chinainsiderwithdavidzhang/ X or Twitter: ...,China Insider with David Zhang,,,[],,,1663245,3517,false,,N/A
jkn8bGK8W48,Animal sounds by cute baby voice,1 million views.,Asim Malik,,,['https://en.wikipedia.org/wiki/Entertainment'],,,1665775,55,false,,N/A
y7R3oRfPMxo,#cartoon #cow #funny #gk #animals #viralvideo #virlshort #comedy #hussainansarimotivational,,Anjali Sharma,,,"['https://en.wikipedia.org/wiki/Entertainment', 'https://en.wikipedia.org/wiki/Film', 'https://en.wikipedia.org/wiki/Humour']",,,1661769,5,false,,N/A
EQCBx8CAcG0,Epic Buffalo Battle: White vs Black Buffalo Showdown! Funny Animal Fights 2024!,Watch Epic Buffalo Battle: White vs Black Buffalo Showdown! Funny Animal Fights 2024! Watch the epic showdown between ...,Super Animals TV,,,"['https://en.wikipedia.org/wiki/Entertainment', 'https://en.wikipedia.org/wiki/Film']",,,1660685,25,false,,N/A
VGI4VYJiqak,Can These 55 Animals Cross Under the Bridge? Watch Which One Fails!,IWelcome to an exciting and educational adventure! Join us as 55 fascinating animals embark on a daring mission to cross under ...,CookieNey,,,[],,,1651269,0,false,,N/A
cYi7Qdjeiyc,"Rounding coconuts Deer, Elephant, Dog &amp; Cow - Animals names magic video",,VFX Jahidul,,,[],,,1643728,22,false,,N/A
bj2t7yGA_0M,A Journey Across Our Planet | 4K UHD | Planet Earth II | BBC Earth,"Across every continent of our magnificent planet, there is wondrous wildlife to be found. From animal parents defending their ...",BBC Earth,,,['https://en.wikipedia.org/wiki/Lifestyle_(sociology)'],,,1637932,287,true,,N/A
qJQoDTkyPAs,pets And Domestic Animals#short,,Simple Gyan,,,['https://en.wikipedia.org/wiki/Pet'],,,1618747,115,false,,N/A
3ZEfeoIIkOw,Rauf &amp; Faik - Animal (Mood Video),Listen to Rauf & Faik - Animal all platforms: https://rauf-faik.bfan.link/animal1 Management/Cooperation: rauf.faik@mail.ru +7 (778) ...,Rauf & Faik,,,"['https://en.wikipedia.org/wiki/Music', 'https://en.wikipedia.org/wiki/Pop_music']",,,1610386,1231,false,,N/A
tbhY7o3Po4I,Animals Rkhe Hain To Kam To Krne Pren Gy😍,Animals Rkhe Hain To Kam To Krne Pren Gy   Asslamualaikum friends ! I am here for you with all of my passion .My goal is to ...,Shehr Main Dihat,,,"['https://en.wikipedia.org/wiki/Lifestyle_(sociology)', 'https://en.wikipedia.org/wiki/Pet']",,,1598217,2260,false,,N/A
