Video ID,Title,Description,Channel Title,Keyword Tags,YouTube Video Category,Topic Details,Video Published at,Video Duration,View Count,Comment Count,Captions Available,Caption Text,Location
oXtkDlniM9Y,क्रेन वाले भईया की हिम्मत रँग लाई 🙏 #animal #animals #animallover #animalrescue #cow,"I upload videos related to animal rescue in my channel. My only aim is that you all watch my video completely, like it and help all ...",WildlifeRescueTV,,,['https://en.wikipedia.org/wiki/Pet'],,,41273001,7492,false,,N/A
n3eu-VYPgRM,Mini Cobra #snake #snakes #snakevideo #pets #animallover #petlovers #animal #pet #animals #cute,Would you like one?,Pet Shorts,,,['https://en.wikipedia.org/wiki/Pet'],,,41129331,3554,false,,N/A
2XZxoAbMVyw,Diana &amp; Roma feed the Animals at the Emirates Park Zoo,Diana Roma and Oliver have a wild day feeding the animals at the Emirates Park Zoo! They'll show you all the amazing animals ...,✿ Kids Diana Show,,,"['https://en.wikipedia.org/wiki/Lifestyle_(sociology)', 'https://en.wikipedia.org/wiki/Pet']",,,40652695,0,false,,N/A
HllZ_kSVNro,Bin Bon duck Monkey Baby Kittens Puppy Goes Koi Cat And swims Rabbits Animals Eats Egg Muckbang Asmr,Bin Bon duck Monkey Baby Kittens Puppy Goes Koi Cat And swims Rabbits Animals Eats Egg Muckbang Asmr Welcome to the ...,Animals Life,,,"['https://en.wikipedia.org/wiki/Lifestyle_(sociology)', 'https://en.wikipedia.org/wiki/Pet']",,,38035495,818,false,,N/A
QQITMD1x39c,"Bison vs. lion: animal strength competition, wild animals up close","Bison vs. lion: animal strength competition, wild animals up close.",Funny Animal World,,,['https://en.wikipedia.org/wiki/Entertainment'],,,36412631,896,false,,N/A
6XTJaodIWQE,The secret to the old snow leopard’s longevity #animals #love #shorts,,JackieMcRe Y,,,[],,,36238576,15452,false,,N/A
aXAsMcmtJTc,"Seals live @ Seal Rehabilitation and Research Centre (Pieterburen, The Netherlands)","[NL    ] Dit is het Golfbad, het grootste bassin van het Zeehondencentrum in Pieterburen. Dit is een Fase 3 verblijf voor gewone ...",Zeehondencentrum Pieterburen,,,[],,,35629934,0,false,,N/A
-iOhwfzOOQw,Touching moments when animals reunite with their saviors who saved their lives #animalshorts,,FADY Fily,,,"['https://en.wikipedia.org/wiki/Entertainment', 'https://en.wikipedia.org/wiki/Film', 'https://en.wikipedia.org/wiki/Pet']",,,34486145,7743,false,,N/A
iO62OyWfUY0,Martin Garrix - Animals (Bass Boosted),Song of the year right here. But with a little more bass.,Le Bass,,,"['https://en.wikipedia.org/wiki/Electronic_music', 'https://en.wikipedia.org/wiki/Music', 'https://en.wikipedia.org/wiki/Pop_music']",,,34406050,9862,false,,N/A
PrILySuk0xI,Smiling shark #animals #cute #shorts,,JackieMcRe Y,,,"['https://en.wikipedia.org/wiki/Lifestyle_(sociology)', 'https://en.wikipedia.org/wiki/Pet']",,,33857372,12915,false,,N/A
hYXiqVto2os,Monkey Baby Bon Bon eat jelly fruit ice cream and naughty with ducklings in the swimming pool,Monkey Baby Bon Bon eat jelly fruit ice cream and naughty with ducklings in the swimming pool #babymonkey #Animal #Animalht ...,Animal HT,,,['https://en.wikipedia.org/wiki/Lifestyle_(sociology)'],,,33886904,0,false,,N/A
bCZWgck7thg,Animal Transformation 🐻‍❄️🦬🦈 #shorts #animals #viral,This video features content that may include material not entirely original to this channel and could have been repurposed from ...,Time Lapse Tales,,,['https://en.wikipedia.org/wiki/Entertainment'],,,33691638,1012,false,,N/A
MCjhynvMunE,What Do You See? Song | Animals and Sounds | Learn English Kids,"Learn 12 Animals like dog, cat, horse, bird, fish and more in this fun song for kids with real animal footage. Plus learn animals ...",Dream English Kids,,,['https://en.wikipedia.org/wiki/Entertainment'],,,33522978,0,true,,N/A
e64O1saNmrw,Zoo Wild Animals Toys Fun For Kids - Learn Animal Names,"Hi kids, today we are going to show you a small zoo set and some toy animals. I hope you guys enjoy this video. Please be sure to ...",RaceToyTime,,,"['https://en.wikipedia.org/wiki/Hobby', 'https://en.wikipedia.org/wiki/Lifestyle_(sociology)']",,,33434137,0,true,,N/A
T9a7ukS-ZQ8,Cheetah vs Gazelle #trending #cheetah #gazelle #male #animals #youtubeshorts #shorts #wildlife,cheetah attacks gazelle man save gazelle man Vs cheetah human Vs cheetah cheetah attacks cheetah hunting cheetah running ...,Rendi goodboy,,,['https://en.wikipedia.org/wiki/Entertainment'],,,32514894,3742,false,,N/A
vAQu_0d-oYM,"The Names Of Animals: Cow, Elephant, Lion, Tiger, Crocodile - Explore Animals In The Jungle","The Names Of Animals: Cow, Elephant, Lion, Tiger, Crocodile - Explore Animals In The Jungle ...",Boo Kids Learning,,,"['https://en.wikipedia.org/wiki/Entertainment', 'https://en.wikipedia.org/wiki/Film']",,,31952518,0,false,,N/A
7kMO9S037GU,Chris learns to feed animals and other useful kids stories,Chris learns to feed animals and other useful kids stories. 00:00 Chris and Alice feed animals at the farm 05:27 Vlad and Niki feed ...,Vlad and Niki,,,['https://en.wikipedia.org/wiki/Lifestyle_(sociology)'],,,31945680,0,false,,N/A
UFpAwT6Gir4,"Farm animals, animal sounds: cow, chicken, pig, elephant, duck, cat sound","Farm animals, animal sounds: cow, chicken, pig, elephant, duck, cat sound Animals living together make very lively and ...",Animal Paradise,,,['https://en.wikipedia.org/wiki/Lifestyle_(sociology)'],,,31939302,1425,false,,N/A
jdWhJcrrjQs,Architects - &quot;Animals&quot;,"Listen to the full album: http://bit.ly/3dVrqVB ""Animals"" by @wearearchitects from the album 'For Those That Wish To Exist,' ...",Epitaph Records,,,"['https://en.wikipedia.org/wiki/Electronic_music', 'https://en.wikipedia.org/wiki/Independent_music', 'https://en.wikipedia.org/wiki/Music', 'https://en.wikipedia.org/wiki/Pop_music', 'https://en.wikipedia.org/wiki/Rock_music']",,,31804149,11499,false,,N/A
NVxT4zCtqWk,"Black Panther vs White Animals (Lion, Tiger, Wolf)",animal #animals #hyena #lion #wolf #blackpanther #pinkpanther #polarbear #leopared #blackleopard #blackpanther.,DIM VIRAL ,,,"['https://en.wikipedia.org/wiki/Entertainment', 'https://en.wikipedia.org/wiki/Film']",,,31573097,1459,false,,N/A
s7DbVTkaXn0,Animals of Amazon 4K - Animals That Call The Jungle Home | Amazon Rainforest |Scenic Relaxation Film,Discover amazing wildlife of Amazon! In this scenic film you will see the most incredible wild animals and birds that call the jungle ...,Scenic Scenes,,,"['https://en.wikipedia.org/wiki/Film', 'https://en.wikipedia.org/wiki/Lifestyle_(sociology)']",,,31209431,2263,false,,N/A
AHj7N8X8Rms,Rain Rain Go Away | Animal Songs | Newborn Baby Songs &amp; Nursery Rhymes,Rain Rain Go Away | Animal Songs | Newborn Baby Songs & Nursery Rhymes Wheels on the Bus | New Kids Songs & Nursery ...,Lalafun - Songs for Kids,,,['https://en.wikipedia.org/wiki/Music'],,,30586920,0,false,,N/A
wL99SAaw3sw,When Animals Go On A Rampage And Got Caught On Camera !,"When Animals Go On A Rampage And Got Caught On Camera ! When animals take charge, you can expect lots of surprises.",WOW TV,,,"['https://en.wikipedia.org/wiki/Entertainment', 'https://en.wikipedia.org/wiki/Pet']",,,30338118,2272,true,,N/A
IPYTxAHeR_o,Martin Garrix - Animals (Official Video),My song Animals is out now and I hope you enjoy the official music video! Martin Garrix - Animals (Official Video) Beatport: ...,Martin Garrix,,,"['https://en.wikipedia.org/wiki/Electronic_music', 'https://en.wikipedia.org/wiki/Music', 'https://en.wikipedia.org/wiki/Pop_music']",,,30297927,4884,false,,N/A
8kCTv3qkNVM,Kitne Pyare Hote Hai Ye ❤️ #elephant #family #love #animals,,Harpreet SDC,,,['https://en.wikipedia.org/wiki/Lifestyle_(sociology)'],,,30274753,1301,false,,N/A
BHb9fNJev64,Wild Animals Learning for Kids With Safari Ocean Sea Animals,Welcome to today's animal episode with Strawberry Jam Toys. Listen to the name of each animal as it shown and practice saying ...,Strawberry Jam Toys,,,"['https://en.wikipedia.org/wiki/Hobby', 'https://en.wikipedia.org/wiki/Lifestyle_(sociology)']",,,30060694,0,false,,N/A
L-QAWuaEg0g,Cow Elephant Lion Gorilla Tiger T-Rex Choose the RIGHT Animal ESCAPE ROOM CHALLENGE MYSTERY BOX,Cow Elephant Lion Gorilla Tiger T-Rex Choose the RIGHT Animal ESCAPE ROOM CHALLENGE OPENING ₹10000 MYSTERY ...,JOJO Cartoon Animals,,,"['https://en.wikipedia.org/wiki/Entertainment', 'https://en.wikipedia.org/wiki/Film']",,,29933058,873,false,,N/A
Vh-sWbTVi9s,Cow Elephant Lion Gorilla Tiger T-Rex Choose The Right Baby ESCAPE ROOM CHALLENGE Animals Cage Game,Cow Elephant Lion Gorilla Tiger T-Rex Choose The Right Baby ESCAPE ROOM CHALLENGE Animals Cage Game Hello !,JOJO Cartoon Animals,,,[],,,29733194,1004,false,,N/A
cnOYCeSdUAg,elephant 🐘 funny short 😀😎#youtubeshorts #animals #animalattitude #trendingshorts #shortvideo #shorts,elephant funny short #youtubeshorts #animals #animalattitude #trendingshorts #shortvideo #shorts Contact email ...,msk420,,,['https://en.wikipedia.org/wiki/Entertainment'],,,28824036,397,false,,N/A
B7BmSzosbxA,Animal Transformation. Before &amp; After! 😎♥️ #beforeandafter #animals,"This video is primarily for entertainment purposes. No copyright infringement is intended. For any concerns or inquiries, please ...",Purrfectia,,,['https://en.wikipedia.org/wiki/Entertainment'],,,27785233,111,false,,N/A
PmhPsZwsSdY,FARM ANIMALS BEING TRANSPORTED TO PASTURE / ANIMAIS DA FAZENDA SENDO TRANSPORTADOS PARA O PASTO,"LET'S PLAY WITH A GIANT BULL, GIANT HORSE, GOAT, COW, PIG ...... VAMOS BRINCAR COM UM TOURO GIGANTE, ...",World Marshall,,,"['https://en.wikipedia.org/wiki/Hobby', 'https://en.wikipedia.org/wiki/Lifestyle_(sociology)']",,,27204288,0,false,,N/A
kCHeKc2R96o,"Pre School Learning For Kids | Animals, Birds, Animal Sounds, Fruits, Flowers, Vegetables","Pebbles present, Pre School Learning For Kids. This Pre School video covers Live Teacher Video Training for Animals, Birds, ...",Pebbles live,,,['https://en.wikipedia.org/wiki/Knowledge'],,,27144296,0,false,,N/A
a6U6AobyWtw,Saving Endangered Animals From Extinction,"This Maasai Mara Conservancy program, led by the Maasai people, has proven to be extremely successful. It provides an ...",Beast Philanthropy,,,[],,,26790978,9953,true,,N/A
GOR2bn6HtE8,"Paint Animals Gorilla, Lion, Tiger, Elephant, Cow Fountain Crossing Animal Cartoon Game","Paint Animals Gorilla, Lion, Tiger, Elephant, Cow Fountain Crossing Animal Cartoon Game #fountaincrossing #crossingfountain ...",TOUHID ROMAN,,,['https://en.wikipedia.org/wiki/Video_game_culture'],,,26315553,114,false,,N/A
nMaLSTv-GIg,"Carnivore, Herbivore and Omnivore Safari Animals for Kids | Soso&#39;s Animal Toys Come to Life!","Come join the fun with Soso and learn about Safari Animal names and sound. Find out which animals are herbivore, carnivore ...",Fun Time With Soso,,,"['https://en.wikipedia.org/wiki/Hobby', 'https://en.wikipedia.org/wiki/Lifestyle_(sociology)']",,,26364263,0,false,,N/A
qP2sEKM2rWw,Snow Animals For Kids | Arctic Animals Follow Soso Through A Magical Portal Into The Park,Come join the fun in this adventure with Soso as she escapes from the Arctic animals using her magical wand to open up a portal.,Fun Time With Soso,,,['https://en.wikipedia.org/wiki/Entertainment'],,,25992099,0,false,,N/A
3pJCqCfSibQ,How different animals fight. (with emojis),A short physical comedy skit about how different animals fight. Part 1. (with emojis version) #animals #fighting #shorts #funny ...,Jiemba Sands,,,['https://en.wikipedia.org/wiki/Entertainment'],,,25119825,574,false,,N/A
b2MbdPEWtGg,"Animals video, for children, cow video, lion, elephant, horse, tiger, cat, dog, animal sounds","Animals video, for children, cow video, lion, elephant, horse, tiger, cat, dog, animal sounds Domestic Animals - Wild Animals ...",Ecología Digital Films,,,"['https://en.wikipedia.org/wiki/Entertainment', 'https://en.wikipedia.org/wiki/Film']",,,25095101,0,false,,N/A
O96MiXxXz6k,Why Animals Don’t Cross This Invisible Border 🚧 Wallace Line 😱,Did you know there's an invisible line in the Malay Archipelago that separates two entirely different worlds of wildlife? This ...,GeoGlobeTales,,,['https://en.wikipedia.org/wiki/Knowledge'],,,25013357,9928,false,,N/A
sb0hne5bQCA,Animals&#39; Mysterious Warning to Humans&quot; #animals #rescue #fox,"Animals' Mysterious Warning to Humans"" - Generative A.I. Creator: Happy Explorer.",Happy Explorer,,,[],,,24804357,12233,false,,N/A
1993eC-5sxo,The little pig who didn’t want to be apart #animals #love #shorts,,JackieMcRe Y,,,"['https://en.wikipedia.org/wiki/Entertainment', 'https://en.wikipedia.org/wiki/Pet']",,,24182796,7002,false,,N/A
x7jbFZPJi74,Jay Gaumata #cow #yshorts #gaumata,,Hardik A,,,[],,,24207984,461,false,,N/A
36IheWFLioQ,Beginner Vs Experienced Horse Owners! 🐴 #shorts #animals,We love owning horses and today we made a funny horse video about beginner horse on our first experience. We were once a ...,The Wild Adventure Girls,,,"['https://en.wikipedia.org/wiki/Humour', 'https://en.wikipedia.org/wiki/Lifestyle_(sociology)', 'https://en.wikipedia.org/wiki/Pet']",,,23652126,1177,true,,N/A
ApVLZoKokUs,China zoo glass protect animals #shortsvideo,"теги: xxxtentacion, empire, rap, bad vibes forever / empire, hip hop & rap, xxx, look at me, lil pump, music, bad vibes forever, sad, ...",The sahitya,,,[],,,23436156,323,false,,N/A
5DGuKehfPVo,Funny animals videos #shorts #shortsfeed #ytshorts #funnycows #funnycowvideo #funnyanimals #funny,Funny animals videos #shorts #shortsfeed #ytshorts #funnycows #funnycowvideo #funnyanimals #funny.,Pragya Mohan Vlog,,,"['https://en.wikipedia.org/wiki/Entertainment', 'https://en.wikipedia.org/wiki/Humour']",,,23403866,584,false,,N/A
KMPAicedgP8,#JasonDeruloTV // Animals #GotPermissionToPost From @animaledventures #MakeMeHappy,,Jason Derulo,,,['https://en.wikipedia.org/wiki/Pet'],,,23221866,330,false,,N/A
AZeU5_YpqsA,Animals x Starboy | Full Version | Aviral Kapasia | Slowed+Reverb,Subscribe aviral Kapasia On Youtube https://youtube.com/@Aviralkapasia Follow Aviral Kapasia Instagram ...,Aviral kapasia,,,"['https://en.wikipedia.org/wiki/Independent_music', 'https://en.wikipedia.org/wiki/Music', 'https://en.wikipedia.org/wiki/Pop_music']",,,23148283,1622,false,,N/A
S3Y_NmQj9gw,Hunters in the Night | “Ah-ooh~! It’s our world!” | Animal song | Song for kids ★ TidiKids,kidssongs #nurseryrhymes #Animal song Para bam para bam para bam para bam Para bam para bam para bam para bam “It's ...,Tidi Kids - Songs & Nursery Rhymes,,,['https://en.wikipedia.org/wiki/Music'],,,22923265,0,false,,N/A
XkYPPUK5jos,Animals,Provided to YouTube by Epitaph Animals · Architects For Those That Wish To Exist ℗ 2020 Epitaph Released on: 2021-02-26 ...,Architects - Topic,,,"['https://en.wikipedia.org/wiki/Independent_music', 'https://en.wikipedia.org/wiki/Music', 'https://en.wikipedia.org/wiki/Pop_music', 'https://en.wikipedia.org/wiki/Rock_music']",,,22769641,156,false,,N/A
DSMT6O4cX6s,How Different Animals Go Down A Slide 😂 Part 3 (with emojis),How animals go down a slide. Part 3 (With Emojis Version) #Shorts #Animals #Funny My other socials: Linktree: ...,Jiemba Sands,,,['https://en.wikipedia.org/wiki/Entertainment'],,,22618928,333,false,,N/A
5D6V5P62U64,"Paint &amp; Animals Duck, Cow, Gorilla, Lion, chicken, Elephant, Fountain Crossing Turtle Cartoon Game",https://www.youtube.com/playlist?list=PLZ1zXhss-AY3dV-AKBVa5NtqiEreKBV9T #fountaincrossing #crossingfountain #gorilla ...,Animals Home Animation,,,"['https://en.wikipedia.org/wiki/Entertainment', 'https://en.wikipedia.org/wiki/Film']",,,22564247,1271,false,,N/A
By8CKu-ZaVM,"Farm Animal Sounds - Cow, Sheep, Cat, Dog, Chicken - Animal Moments","The farm is always bustling with the sounds of animals. In the morning, very early, the rooster crowed to wake everything up.",Animal Moments,,,"['https://en.wikipedia.org/wiki/Lifestyle_(sociology)', 'https://en.wikipedia.org/wiki/Pet']",,,22555866,948,false,,N/A
EpvNfhCmiR4,10 ऐसे जानवर जो शेर की जान ले सकते हैं . 10 ANIMALS THAT CAN KILL A LION .,"Also,follow us on fb: https://www.facebook.com/Vichitra4u insta: https://www.instagram.com/vichitra_4u Watch Our Other Videos ...",Vichitra 4u,,,[],,,22322671,1949,false,,N/A
cCB6Rd3GgbY,Kawawa naman lumaban pa kasi #dog #animalsanimalsanimals #dogsdogsdogs #animals #humor #doggie #dogs,,gani pascuaTV,,,"['https://en.wikipedia.org/wiki/Entertainment', 'https://en.wikipedia.org/wiki/Humour', 'https://en.wikipedia.org/wiki/Pet']",,,22477796,2116,false,,N/A
SLdVUYZrzsw,RAISING FROG ARMY! #animalstories #animals #animalrescue #cute #pets #frogs #frog,,Nature Global,,,['https://en.wikipedia.org/wiki/Pet'],,,22113559,1860,false,,N/A
y1ukWpEFG9I,Charming fox #animals #love #shorts,,JackieMcRe Y,,,"['https://en.wikipedia.org/wiki/Entertainment', 'https://en.wikipedia.org/wiki/Pet']",,,22109486,7416,false,,N/A
7wtGUA8uu0Y,This super talented kid can mimic any animal voice,"This content doesn't belong to me, it is edited and shared only for awareness & knowledge and if the content OWNER ...",Discover with Akash,,,"['https://en.wikipedia.org/wiki/Entertainment', 'https://en.wikipedia.org/wiki/Humour']",,,21779906,0,false,,N/A
fLTjpMOruhI,Just Dance 2016 - Animals - Martin Garrix - 5 Stars,"Suscribe here http://goo.gl/9Gva7w Share the video in facebook https://goo.gl/YuaRjh, twitter https://goo.gl/UmjcL8, google + ...",jomarocasgameplay,,,"['https://en.wikipedia.org/wiki/Music_video_game', 'https://en.wikipedia.org/wiki/Video_game_culture']",,,21662399,1734,true,,N/A
NsrdiylJBBg,Learn animal names for babies toddlers preschoolers | kids,Learn animal names for babies toddlers preschoolers | kids. Learn a whole host of animals from pets to farm animals to safari ...,Ed bot TV,,,"['https://en.wikipedia.org/wiki/Hobby', 'https://en.wikipedia.org/wiki/Lifestyle_(sociology)']",,,21653629,0,false,,N/A
aW-U66Uwm2c,&quot;The Animal Dance Game!&quot; 🐙🐊🐒 Would You Rather Brain Break | Danny Go! Songs for Kids,Are you ready to DANCE like some of your favorite animals? Join Danny in an exciting this or that dancing game where you ...,Danny Go!,,,"['https://en.wikipedia.org/wiki/Music', 'https://en.wikipedia.org/wiki/Pop_music']",,,21591230,0,true,,N/A
Fbtd4bEjyUM,Animals Battle Arena! (Bald Eagle),animals #wildlife #animal #eagle #baldeagle.,WB,,,[],,,21364778,2302,false,,N/A
vejwySV2zg0,Lion attack buffalo in African forest | lion attack animal | lion attack video stories part 8,Lion attack buffalo in African forest | lion attack animal | lion attack video stories part 8 is new episode . discovery andenjoy Lion ...,Wild Fighter,,,"['https://en.wikipedia.org/wiki/Entertainment', 'https://en.wikipedia.org/wiki/Film']",,,21187575,1450,false,,N/A
LNeBYxRwfWo,"Animals Collection Volume 2 - Farm Animals, Mammals, Pets, Reptiles - The Kids&#39; Picture Show","This collection includes Farm Animals, Insects, Pets, Indian Mammals, North American Forest Mammals, and Reptiles.",The Kids' Picture Show,,,['https://en.wikipedia.org/wiki/Knowledge'],,,20867753,0,true,,N/A
tEFUNLFwPoM,Greatest Fights in the Animal Kingdom: Part 3 | BBC Earth,"From iconic scenes to unusual contests, the animal world is full of face-offs. For family or territory, these determined animals won't ...",BBC Earth,,,"['https://en.wikipedia.org/wiki/Entertainment', 'https://en.wikipedia.org/wiki/Film']",,,20836741,3178,false,,N/A
QBSMouV7taU,#shorts #shortsvideo #rescue #cuteanimals #animals #animalshorts #rescue #healing,,Lshmi Powell,,,"['https://en.wikipedia.org/wiki/Entertainment', 'https://en.wikipedia.org/wiki/Film', 'https://en.wikipedia.org/wiki/Pet']",,,20639975,15681,false,,N/A
0_9-xr6n8Rk,Animal Sounds Song | Best Animal Sounds Song | Baby Song  | Kids Song,Welcome to Super Kids! Learning song for children will be presented.Let's be happy and sing together. # kids songs # nursery ...,Super Kids,,,['https://en.wikipedia.org/wiki/Music'],,,20579521,0,false,,N/A
HNzmrEgz_GI,The Animals - It&#39;s My Life,0:44 It's a hard world to get a break in All the good things have been taken But girl there are ways to make certain things pay ...,Reddy,,,"['https://en.wikipedia.org/wiki/Music', 'https://en.wikipedia.org/wiki/Pop_music', 'https://en.wikipedia.org/wiki/Rhythm_and_blues', 'https://en.wikipedia.org/wiki/Rock_music']",,,20371865,4513,false,,N/A
hG_HCsC_blI,The bird and its guardian #animals #love #shorts,,JackieMcRe Y,,,"['https://en.wikipedia.org/wiki/Lifestyle_(sociology)', 'https://en.wikipedia.org/wiki/Pet']",,,20363175,3294,false,,N/A
u3WUdGPs03k,Serpiente Come Animal Grande 🐍,,Dan,,,[],,,20145108,440,false,,N/A
wD1TtgzU8BU,Draw Animals And Their Food - Animals Come To Life From The Painting | Boo Kids Cartoon,Draw Animals And Their Food - Animals Come To Life From The Painting | Boo Kids Cartoon ...,Boo Kids Learning,,,"['https://en.wikipedia.org/wiki/Entertainment', 'https://en.wikipedia.org/wiki/Film']",,,19346404,0,false,,N/A
u7rOPZIfP4s,&quot;Skinwalker disguised as Animals&quot; | #animals #factvideo #facts #scary,,Factspedia,,,[],,,19276280,5055,false,,N/A
aTGQvQ5q2Dc,Something went wrong inside the crab tank! #crabs #fish #pets #animal,,Indian Fish Guy,,,"['https://en.wikipedia.org/wiki/Lifestyle_(sociology)', 'https://en.wikipedia.org/wiki/Pet']",,,18757793,306,false,,N/A
sjVpQ2eQ0xE,"Let&#39;s Learn Animals Name in Hindi || Cute Animals Video Cow, zebra || Animals Video | #cow cow video","Let's Learn Animals Name in Hindi || Cute Animals Video Cow, zebra || Animals Video | #cow cow video || let's learn Animals ...",Sa Sa Om Tv,,,[],,,18196056,0,false,,N/A
_d4zSb3OR7g,Funniest Farm Animals,"These hootin' & hollerin' animals thought they'd find a nice pasture to graze on the farm...little did they know, they'd only find fresh ...",The Pet Collective,,,"['https://en.wikipedia.org/wiki/Lifestyle_(sociology)', 'https://en.wikipedia.org/wiki/Pet']",,,18125430,1036,false,,N/A
w6ChEmjsXCM,Animals Seeing Themselves For The First Time!,Here are some animals seeing their reflections for the first time! You can also find more than 100 videos of wild animal encounters ...,CubeHub01,,,['https://en.wikipedia.org/wiki/Lifestyle_(sociology)'],,,17931744,12436,false,,N/A
G3OBC7mJ21w,Martin Garrix Animals vs Tsunami (Remix),"Just a little mash up I made, hope you enjoy it Dont forget to subscribe, like and share The content of the songs do not belong to ...",Sind D,,,"['https://en.wikipedia.org/wiki/Electronic_music', 'https://en.wikipedia.org/wiki/Music', 'https://en.wikipedia.org/wiki/Pop_music']",,,17871292,2100,false,,N/A
D-_Wt5gbXYg,動物たちの愛情に包まれて 🥰🥰,,愛するための人生,,,"['https://en.wikipedia.org/wiki/Lifestyle_(sociology)', 'https://en.wikipedia.org/wiki/Pet']",,,17561181,8117,false,,N/A
qXWrnolG5Ks,DEAD Animals Scientists Are Close to Reviving!,Coming up are some extinct animals scientists are close to revising from extinction! Suggest a topic here to be turned into a video: ...,BE AMAZED,,,['https://en.wikipedia.org/wiki/Knowledge'],,,17367628,8367,true,,N/A
IkkjXzBfWjE,Fastest Land Animals For Kids | Soso Turns Her Fastest Land Animal Toys To Life!,"Come join the fun with Soso! In this fun-filled animal story, Soso turns her fastest animal toys to life and have them race against ...",Fun Time With Soso,,,['https://en.wikipedia.org/wiki/Entertainment'],,,17339331,0,false,,N/A
IP67-0cL_Ag,2 HOURS OF BLIPPI ANIMALS | Best Animal Videos for Kids | Educational Videos for Kids | Blippi Toys,"Enjoy this compilation of the very best of Blippi and his adventures with all animals. In this animal video, he visits zoos and ...",Blippi Toys,,,"['https://en.wikipedia.org/wiki/Entertainment', 'https://en.wikipedia.org/wiki/Pet']",,,17311591,0,false,,N/A
WTwc2KtU5JE,30 காட்டு விலங்குகள்| Kattu vilangugal | 30 Tamil Wild animals name video for Kids | Adipadai Tamil,30 காட்டு விலங்குகள்|Learn 30 Tamil Wild animals name video for Kids and Children|Tamil Flashcard for Kids ...,Tamilarasi,,,['https://en.wikipedia.org/wiki/Knowledge'],,,17322280,0,false,,N/A
xJtrStvHFaI,Bison vs Buffalo #animals #coolanimals #animalfacts,,TyAmongAnimals,,,[],,,17301108,7412,false,,N/A
Ge7TGaQivJw,Before &amp; After Animals Growing Up. Amazing Animal Transformation💥 #animaltransformations #animals,Prepare to be amazed as we reveal the astonishing transformations of three incredible animals! Witness the incredible changes in ...,Wild Transform,,,[],,,17195873,183,false,,N/A
Osq98au7rJE,This Is How Different Animals Yawn,"dastan #facts #trending #viral #new #latest About - Dastan is a YouTube Channel, where you will find amazing videos ...",Dastan,,,"['https://en.wikipedia.org/wiki/Entertainment', 'https://en.wikipedia.org/wiki/Film']",,,17134810,815,false,,N/A
_0-yWSN0lFM,fastest animal in the world #trending #animals #peregrinefalcon #cheetah #blackmarlin #falcon#shorts,the fastest animal in the world the fastest land creature in the world animals lion cheetah gazelle horse peregrine falcon man ...,Rendi goodboy,,,[],,,16566284,2430,false,,N/A
UgMB9l_iMJA,100 Animals of the World - Learning the Different Names and Sounds of the Animal Kingdom,"Ready to learn and discover 100 different animals of the world? Here's a treat for you, here's a collection real 100 animal videos ...",Kiddos World TV,,,['https://en.wikipedia.org/wiki/Entertainment'],,,16435090,0,false,,N/A
U0mQCb1NUbs,Vlad and Niki feed the animals at the Zoo,Vlad and Niki feed the animals at the Zoo. Please Subscribe!,Vlad and Niki,,,['https://en.wikipedia.org/wiki/Lifestyle_(sociology)'],,,16332797,0,false,,N/A
