Video ID,Title,Description,Channel Title,Keyword Tags,YouTube Video Category,Topic Details,Video Published at,Video Duration,View Count,Comment Count,Captions Available,Caption Text,Location
kWr3cKdj6GQ,"Three little kittens, The animals on the farm + More | Jolly Jolly - Learn and Play - Nursery Rhymes","Three little kittens, The animals on the farm + More | Jolly Jolly - Learn and Play - Nursery Rhymes #kidssongs #nurseryrhymes ...",Jolly Jolly - Learn and Play - Nursery Rhymes,,,"['https://en.wikipedia.org/wiki/Entertainment', 'https://en.wikipedia.org/wiki/Film']",,,16290649,0,false,,N/A
oRDRfikj2z8,Baby Animals 4K - Amazing World Of Young Animals | Scenic Relaxation Film,Sit back and relax while enjoying this scenic film captures the marvelous and amazing world of cute baby animals. In this ...,Scenic Scenes,,,"['https://en.wikipedia.org/wiki/Film', 'https://en.wikipedia.org/wiki/Lifestyle_(sociology)']",,,16184200,1064,false,,N/A
Q3mgapAcVdU,The Animals - We Gotta Get Out Of This Place (1965) HD/widescreen ♫♥,Special widescreen version of The Animals performing 'We Gotta Get Out Of This Place' from an American motion picture ...,Eric Burdon Tribute Channel 8,,,"['https://en.wikipedia.org/wiki/Music', 'https://en.wikipedia.org/wiki/Pop_music', 'https://en.wikipedia.org/wiki/Rhythm_and_blues', 'https://en.wikipedia.org/wiki/Rock_music', 'https://en.wikipedia.org/wiki/Soul_music']",,,16014079,5440,false,,N/A
0opedoxLbVU,Farm Animals For Kids | Farm Animals Come Out Of A Book!,"Are you ready to have a Fun Time With Soso! In this farm animal adventure story for kids, Soso's magical wand accidentally brings ...",Fun Time With Soso,,,['https://en.wikipedia.org/wiki/Entertainment'],,,15969730,0,false,,N/A
tuW974_U_UU,#cow #animals #funny #comedy #bull #cowsound #buffalocomedy #comedyfilms #funnybuffalo #comedymovie,,Funnyshorts,,,"['https://en.wikipedia.org/wiki/Entertainment', 'https://en.wikipedia.org/wiki/Humour']",,,15972210,143,false,,N/A
bljP6u4H14M,Hero Animals That Saved Human Lives| Best moment of 2023!,"Hero Animals That Saved Human Lives Animals will always be there when humans need help… With their incredible courage, ...",WOW TV,,,"['https://en.wikipedia.org/wiki/Entertainment', 'https://en.wikipedia.org/wiki/Pet']",,,15716163,2560,true,,N/A
v9H8P22SHbA,Unusual Wedding: When Nature Witnesses Wordless Love #nature #animals #funny #love #trending,"Scene simulation: In the cool green valley, the male orangutan holds the baby orangutan in his strong arms, his eyes full of love, ...",Love nature - Protect animals,,,['https://en.wikipedia.org/wiki/Entertainment'],,,15611287,698,false,,N/A
KgzmJUUk8w0,The origin of new species by AI creator #animal fusion #hybrids #shorts #youtubeshorts,The origin of new species by AI creator #animal fusion #hybrids #shorts #youtubeshorts #ai Creator #evolution ...,Ai Creator,,,['https://en.wikipedia.org/wiki/Entertainment'],,,15541325,1017,false,,N/A
0mQliQbaxgg,50 ANIMALS Name and Sound | English to Hindi | Animals for kids | WATRstar,50 ANIMALS Name and Sound | English Hindi | Animals for kids | WATRstar In this video we have shown 50 Animals Name and ...,WATRstar - The learning hub,,,[],,,15344904,0,false,,N/A
XVPXzM8NL8M,Schleich Safari Animal Nursery Playset  and Fun Animals Toys For Kids,,RaceToyTime,,,"['https://en.wikipedia.org/wiki/Hobby', 'https://en.wikipedia.org/wiki/Lifestyle_(sociology)']",,,15232749,0,true,,N/A
pJChvXz7P8k,"Tiger 🐯🍅👍, Duck 🦆🍅👍 &amp; Giraffe 🦒🍅……… ? #shorts",,Minaz Shaikh,,,['https://en.wikipedia.org/wiki/Lifestyle_(sociology)'],,,15140603,45,false,,N/A
RNO37kwSdBA,Two men accidentally discovered a giant python in their garden #animals #shorts,,Opawumi Oluwatobi,,,[],,,14794765,655,false,,N/A
ysbVo6iUQFc,Black panther attack on baby calf #cow #blackpanther #motherslove #animals,Black panther attack on baby calf @MohammadHussain-bp8nj @minebuilds-f4s #cow #cowlover #cowcalf #indiancow #calf ...,ALPHA CLUB,,,[],,,14508335,1165,false,,N/A
DYf28lOb8KU,Animals (Radio Edit),Provided to YouTube by IIP-DDS Animals (Radio Edit) · Martin Garrix Animals ℗ STMPD RCRDS Released on: 2013-06-17 ...,Martin Garrix - Topic,,,"['https://en.wikipedia.org/wiki/Electronic_music', 'https://en.wikipedia.org/wiki/Music', 'https://en.wikipedia.org/wiki/Pop_music']",,,14540592,299,false,,N/A
DIM3fvtGIiY,Animal Dance Song - Rescue Team | RoyalCoco Nursery Rhymes &amp; Kids Songs,Animal Dance Song - Rescue Team | RoyalCoco Nursery Rhymes & Kids Songs -------------------- Lyrics: It's the animal dance (it's ...,RoyalCoco Kids Songs,,,['https://en.wikipedia.org/wiki/Music'],,,14472330,0,false,,N/A
gLo2MmMm9hs,My New Pets #animal #pets #tarantula #nature #wildlife #spider,,Indian Fish Guy,,,['https://en.wikipedia.org/wiki/Pet'],,,14434946,845,false,,N/A
4sYNBViSq-8,Funniest Animals 2024 🤣😅 New Funny Cats and Dogs Videos 😸🐶 Part,Pets #Funny #Cats #Dogs -------------------------------------------- Welcome to Diary Pets! We've selected the best of the funniest and ...,Diary Pets,,,"['https://en.wikipedia.org/wiki/Humour', 'https://en.wikipedia.org/wiki/Lifestyle_(sociology)', 'https://en.wikipedia.org/wiki/Pet']",,,14406445,1720,false,,N/A
wzRa-4W4NfE,"Alien vs T rex vs White Animals ( Godzilla, lion, polar bear, king kong, Wolf, blackpanther, hyena )",animal #animals #alien #trex #godzilla #kingkong #rhino #hyena #lion #wolf #blackpanther #aliens #pinkpanther #polarbear ...,DIM VIRAL ,,,['https://en.wikipedia.org/wiki/Entertainment'],,,14347815,379,false,,N/A
twgmvx9-Vuo,Rabbit growth | Cute Baby Rabbit 1 To 15 Days #pets #animals,rabbit growth baby rabbit growing up baby rabbit growth video baby rabbit growing up day by day #rabbit #bunny #pets #cute ...,DoDo HosS,,,['https://en.wikipedia.org/wiki/Pet'],,,14304615,891,false,,N/A
5kozt0uDa4c,Amazing Scene of Wild Animals In 4K - Scenic Relaxation Film,Discover amazing wildlife and relax! In this nature film you will see the most incredible and stunning wild animals and birds!,Scenic Scenes,,,"['https://en.wikipedia.org/wiki/Film', 'https://en.wikipedia.org/wiki/Tourism']",,,14008204,986,false,,N/A
drkOBuiGPCM,Old MacDonald Song with Safari Animals | Lalafun Nursery Rhymes &amp; Kids Songs,"Old MacDonald meets safari animals like lions, zebras, and elephants on his wild farm! Lyrics: ""Old MacDonald had a farm ...",Lalafun - Nursery Rhymes,,,['https://en.wikipedia.org/wiki/Music'],,,13785022,0,false,,N/A
cHAR9Ti5AWQ,"Mammoth vs Anaconda vs White Animals Battle (black panther, Tiger, bear, dainasour, king kong T rex)",mammoth #anaconda #animal #animals #lion #wolf #blackpanther #pinkpanther #polarbear #leopared #dinosaur #dragon ...,DIM VIRAL ,,,"['https://en.wikipedia.org/wiki/Entertainment', 'https://en.wikipedia.org/wiki/Film']",,,13439517,330,false,,N/A
0fZyNUikfEM,Animals,Provided to YouTube by Roadrunner Records Animals · Nickelback All the Right Reasons ℗ 2005 The All Blacks B.V. Lead ...,Nickelback - Topic,,,"['https://en.wikipedia.org/wiki/Music', 'https://en.wikipedia.org/wiki/Pop_music', 'https://en.wikipedia.org/wiki/Rock_music']",,,12900262,569,false,,N/A
-alVWmtIRYM,Incredible Animal Fusion: Mind-Blowing Creatures Formed by Fusing Different Species🤯🧬 #short#hybrids,Incredible Animal Fusion: Mind-Blowing Creatures Formed by Fusing Different Species #shorts Dive into the world of hybrid ..., Planet of Ai,,,"['https://en.wikipedia.org/wiki/Entertainment', 'https://en.wikipedia.org/wiki/Film']",,,12913285,1026,false,,N/A
vqQzM90S28U,Lion attack on a baby horse 😭 #lion #horse #babyanimals #weakanimals #helptheanimals #rescueanimals,Lion attack on a baby horse @MohammadHussain-bp8nj @minebuilds-f4s @alphagamerhassan #horse #babyhorses #foal ...,ALPHA CLUB,,,[],,,12800797,475,false,,N/A
cw_w8kj_AyI,Chimpanzees take care of human infants #ai   #cute #animals #funny,,Adi's whimsical ideas,,,[],,,12742141,1646,false,,N/A
3ovC3hhrcqk,Farm animal sounds Farm animals for kids Learn Farm animals,"Farm animal sounds. Farm animals for kids. Learn Farm animals. In this video for children, you can see a lot of animals. Kids will ...",My Little Star English,,,['https://en.wikipedia.org/wiki/Entertainment'],,,12761044,0,false,,N/A
cAmuOQ5TaeE,"Guess 120 Animals in 3 Seconds | Easy, Medium, Hard, Impossible",Can you name 120 animals within just 3 seconds? Test your animal knowledge with this challenging quiz! Think you can guess ...,Quiz Blitz,,,['https://en.wikipedia.org/wiki/Knowledge'],,,12345178,0,true,,N/A
cAmuOQ5TaeE,"Guess 120 Animals in 3 Seconds | Easy, Medium, Hard, Impossible",Can you name 120 animals within just 3 seconds? Test your animal knowledge with this challenging quiz! Think you can guess ...,Quiz Blitz,,,['https://en.wikipedia.org/wiki/Knowledge'],,,12345178,0,true,,N/A
A2r-_fTxlDU,"Wild Animals Attacks Farm Animals Compilation - Lion, Fox, Tiger, Cows, Bison, Sheep, Goat, Elephant","Watch Wild Animals Attacks Farm Animals Compilation - Lion, Fox, Tiger, Cows, Bison, Sheep, Goat, Elephant. #wildlife ...",Toon Animals,,,"['https://en.wikipedia.org/wiki/Entertainment', 'https://en.wikipedia.org/wiki/Film']",,,11811560,315,false,,N/A
bh2AVUWOyWY,"CUTE LITTLE ANIMALS - CAT, DOG, CHICKEN, COW, ELEPHANT, HORSE - ANIMAL SOUNDS | FUNNY ANIMAL MOMENTS","CUTE LITTLE ANIMALS - CAT, DOG, CHICKEN, COW, ELEPHANT, HORSE - ANIMAL SOUNDS | FUNNY ANIMAL MOMENTS ...",Qiqi Channel,,,['https://en.wikipedia.org/wiki/Pet'],,,11749569,608,false,,N/A
ucE0jTT_GNY,Falling hedgehogs bring unexpected surprises #animals #love #shorts,,JackieMcRe Y,,,['https://en.wikipedia.org/wiki/Pet'],,,11676880,3708,false,,N/A
X72RXQdi_Gk,Always be kind to Animals 🐱🐶,shorts.,LosWagners ENG,,,"['https://en.wikipedia.org/wiki/Entertainment', 'https://en.wikipedia.org/wiki/Pet']",,,11418419,1552,false,,N/A
BY0lsSm4JUo,This girl can talk to animals 😂,,Dylan Anderson,,,['https://en.wikipedia.org/wiki/Lifestyle_(sociology)'],,,11310110,2822,false,,N/A
pb-j3svRQLI,Animals Of The World 4K - Scenic Wildlife Film With Calming Music,Animals are what makes our planet so special! Enjoy this 4k Scenic Relaxation film to witness the majestic wildlife of our ...,Scenic Relaxation,,,"['https://en.wikipedia.org/wiki/Film', 'https://en.wikipedia.org/wiki/Lifestyle_(sociology)']",,,11280925,870,false,,N/A
dSLDgMKnfek,4K African Wildlife: Most Amazing Animal Encounters in Kwazulu-Natal With Real Sounds in 4K,4K African Wildlife: Most Amazing Animal Encounters in Kwazulu-Natal With Real Sounds In this Animals & Wildlife 4K ULTRA HD ...,Relaxing Nature In 4K,,,[],,,11244187,266,false,,N/A
VlmfYuTyblA,The Animal Sound Song A12A13 || Kids Songs and Nursery Rhymes || EduFam ~,KidsDianaShow @Pinkfong @ChuChuTV @LooLooKids @LittleBabyBum @JioCinemaKidsPremium @SuperSimpleSongs ...,EduFam,,,['https://en.wikipedia.org/wiki/Music'],,,11250057,0,false,,N/A
RWb_gaBk_mo,Why Domestic Animals Need Horns Trimming But Wild Dont? 🤔,"Why do domestic animals need their horns trimmed sometimes, while wild animals don't seem to need any trimming? Well, horns ...",Jasper Storm,,,[],,,11082414,1216,false,,N/A
z5RoNmz5jJM,Animals That Went Extinct,fyp #extinct #animals #giant #creepy #scary #ocean.,Pink Coconuts,,,[],,,11068464,21165,false,,N/A
scjUUQ825BA,The person the bear can’t bear to forget #animals #love #shorts,,JackieMcRe Y,,,"['https://en.wikipedia.org/wiki/Entertainment', 'https://en.wikipedia.org/wiki/Film']",,,10945816,2515,false,,N/A
i-A_Of4bU8I,A battle of strength between wild animals,A battle of strength between wild animals.,Funny Animal World,,,"['https://en.wikipedia.org/wiki/Entertainment', 'https://en.wikipedia.org/wiki/Film']",,,10940540,212,false,,N/A
v7M9Lx47-3s,Best Animal Songs for Children | +Compilation | Animal Songs | Pinkfong Nursery Rhymes for Kids,Watch Baby Shark Dance ➡️https://www.youtube.com/watch?v=XqZsoesa55w Visit our Official Store: ...,Baby Shark - Pinkfong Kids’ Songs & Stories,,,['https://en.wikipedia.org/wiki/Music'],,,10817115,0,false,,N/A
KFTV-wcTCpw,"Beautiful Animal Moments - Dog, Cat, Chicken, Elephant, Cow, Sheep - Animal Sounds",Let's explore the beautiful moments of animals and the unique sounds they make. Dogs often bark to communicate and express ...,Animal Moments,,,"['https://en.wikipedia.org/wiki/Lifestyle_(sociology)', 'https://en.wikipedia.org/wiki/Pet']",,,10622838,499,false,,N/A
MnXNOR46ACU,Unbelievable Animal Noises on America&#39;s and Britain&#39;s Got Talent!,The Judges Loved These UNCANNY Auditions! Featuring Lily Wilker from America's Got Talent and Jessica Brodin from Britain's ...,Kids Got Talent,,,"['https://en.wikipedia.org/wiki/Entertainment', 'https://en.wikipedia.org/wiki/Television_program']",,,10591626,0,false,,N/A
GRde7WGScrM,Animals of Africa 4K - Scenic Relaxation Film With Calming Music,Africa's wildlife is unmatched to the rest of the world! Enjoy this 4k scenic relaxation to witness the majestic animals of Africa.,Scenic Relaxation,,,"['https://en.wikipedia.org/wiki/Entertainment', 'https://en.wikipedia.org/wiki/Film', 'https://en.wikipedia.org/wiki/Tourism']",,,10552075,1022,false,,N/A
HbH_20Lt8lg,Animals,Provided to YouTube by Roadrunner Records Animals · Nickelback All the Right Reasons ℗ 2005 The All Blacks B.V. Lead ...,Nickelback - Topic,,,"['https://en.wikipedia.org/wiki/Music', 'https://en.wikipedia.org/wiki/Pop_music', 'https://en.wikipedia.org/wiki/Rock_music']",,,10527913,180,false,,N/A
XXAkQRnFI6k,The animals 🤣😂 Omg 😅 #funnyanimals #animalsfunny #pets #shorts,Which moment made you laugh the most? Let us know in the comments!     Pet Fun animal videos.,Pet-Fun ,,,"['https://en.wikipedia.org/wiki/Entertainment', 'https://en.wikipedia.org/wiki/Humour', 'https://en.wikipedia.org/wiki/Pet']",,,10341135,284,false,,N/A
7ZhdXgRfxHI,Incredible 4K Nature Scenes Narrated By David Attenborough | BBC Earth,"Relax with extraordinary 4K nature footage narrated by Sir David Attenborough, the voice of natural history for over 70 years.",BBC Earth,,,"['https://en.wikipedia.org/wiki/Entertainment', 'https://en.wikipedia.org/wiki/Film', 'https://en.wikipedia.org/wiki/Television_program']",,,10039939,605,false,,N/A
4HcKSh04c4g,Please save animals 🙏😭💔 #foryou #animals #motivation #emotional #shorts,,Mansoor Official_22,,,[],,,9794200,182,false,,N/A
hG1YVzyLsNo,Heartfelt moments as animals reunite with their friends #shorts,"Welcome to our channel, where you'll discover love and happiness. To create these videos, we meticulously collect and select ...",AnimalLove Stories,,,"['https://en.wikipedia.org/wiki/Entertainment', 'https://en.wikipedia.org/wiki/Film', 'https://en.wikipedia.org/wiki/Pet']",,,9756979,2629,false,,N/A
Jjwey3Y3Ssw,We don’t get out much #animals,,Jay & Sharon,,,['https://en.wikipedia.org/wiki/Lifestyle_(sociology)'],,,9659542,4794,false,,N/A
6Jf_VkVLGGA,Animals That Seem Invisible 😳,snake #fish #butterfly #shorts #shortsfeed Animals That Seem Invisible Even When They're Right in Front of You!! Number One: ...,Moggerly,,,[],,,9636443,360,false,,N/A
VcceOH_QQVc,"Shiva vs Animals vs Vishnu (T Rex, Dinosaur, Lion, Orca, Elephant, Rhino)",Lion #Rhinoceros #PolarBear #Gorilla #Orca #Elephant #Triceratops.,Towards the Future with AI,,,['https://en.wikipedia.org/wiki/Entertainment'],,,9542155,3831,false,,N/A
6pQlG5Szb4A,Safari Animal Toys Figurines Collection,"Today, we are going to show you my collection of Safari Animal Figurines or toys. The figurines are combination of Papo, Schleich ...",RaceToyTime,,,"['https://en.wikipedia.org/wiki/Hobby', 'https://en.wikipedia.org/wiki/Lifestyle_(sociology)']",,,9520537,0,false,,N/A
dXXBWzIzBMU,Alphabet Animals Song | Learn ABC Phonics And Animals | Lah-Lah Nursery Rhymes and Kids Songs,Learn letters and their phonic sounds in this exciting first step for preschoolers. Join Lah-Lah and Buzz as they sing and sound out ...,Lah-Lah,,,['https://en.wikipedia.org/wiki/Entertainment'],,,9557438,0,true,,N/A
fFLiNsZM4w8,Maroon 5 - Animals (slowed) &amp; Reverb,"Animals #Maroon5 #TikTok Maroon 5 - animals (slowed) & reverb ~~~~~~~~~~~~~~~~~~~~~~~~~~~~~~ hi guys, I hope you ...",s h e c k l e r .,,,"['https://en.wikipedia.org/wiki/Music', 'https://en.wikipedia.org/wiki/Pop_music']",,,9449534,924,false,,N/A
CWdsqvg0wCw,Mystery of Yeti SOLVED! | Were they Real Animals? | Dhruv Rathee,Download the Ginni AI app: Android: https://play.google.com/store/apps/details?id=com.aiteacherapp iOS: ...,Dhruv Rathee,,,['https://en.wikipedia.org/wiki/Entertainment'],,,9423876,21096,true,,N/A
ifc5cAEvTw8,Most dangerous animal in the world,sciencefacts ##science #animals #ocean #mystery.,Doctor NOS,,,['https://en.wikipedia.org/wiki/Entertainment'],,,9385212,7044,false,,N/A
6hLYGThOyAs,HÃY CẨN THẬN VỚI CON BẠCH TUỘC LỚN #amazingfacts #animals,HÃY CẨN THẬN VỚI CON BẠCH TUỘC LỚN.,Mắt kính cận,,,['https://en.wikipedia.org/wiki/Entertainment'],,,9365594,609,false,,N/A
b6tyNxChmW0,"The Magical World Of Cute Young Animals With Relaxing Music (Colorfully Dynamic), Soothing Music",Welcome to Musical Feelings I want to bring you the best footage of the animal world that I have recorded in my journeys to ...,Musical Feelings,,,['https://en.wikipedia.org/wiki/Lifestyle_(sociology)'],,,9333027,244,false,,N/A
txDldGXjjmI,Learn Wild Animals For Kids | Wild Zoo Animals Names and Sounds for Children | Club Baboo,Learn Wild Animals For Kids. Zoo Animals Names and Sounds! Learn the names and sounds of these Wild Zoo Animals with Club ...,Club Baboo,,,"['https://en.wikipedia.org/wiki/Entertainment', 'https://en.wikipedia.org/wiki/Film']",,,9309907,0,false,,N/A
AU5PhIZa6Qw,UNIQUE ANIMALS COLLECTION - 8K (60FPS) ULTRA HD - With Nature Sounds (Colorfully Dynamic),UNIQUE ANIMALS COLLECTION - 8K (60FPS) ULTRA HD - With Nature Sounds (Colorfully Dynamic) Enjoy the peaceful and ...,8K Scenic Relaxation,,,[],,,9178862,278,true,,N/A
PCcFHjeFw7g,#shorts #shortsvideo #animals #animalshorts #cuteanimals #rescue #healing #animalrescue #cute,,Wonderful animals ,,,"['https://en.wikipedia.org/wiki/Entertainment', 'https://en.wikipedia.org/wiki/Film', 'https://en.wikipedia.org/wiki/Pet']",,,9176144,4781,false,,N/A
jqOJMo5f_bY,60 Minutes Of Weird and Perfect Animals | Dodo Kids | Animal Videos For Kids,Bee rescuers! A cat obsessed with beards! The pittie cozy patrol! And so much more! It's an entire hour of weird and wonderful ...,Dodo Kids,,,"['https://en.wikipedia.org/wiki/Entertainment', 'https://en.wikipedia.org/wiki/Pet']",,,9131704,0,false,,N/A
u4RZ7T5DJoA,Oliver takes care of the Animals at the Pet Hotel,"Oliver takes care of the Animals at the Pet Hotel. See how he feeds, plays, and takes care of each furry friend with love and care.",✿ Kids Diana Show,,,"['https://en.wikipedia.org/wiki/Lifestyle_(sociology)', 'https://en.wikipedia.org/wiki/Pet']",,,9099773,0,false,,N/A
x6M2ww8tvDY,lonely Black calf #cow #calf #animals #pets #humanity #help #success #cow #babyanimal #emotional,lonely Black calf @minebuilds-f4s #cow #cowcalf #cowlover #indiancow #animals #animallover #wildlife #humanity #babyanimal ...,ALPHA CLUB,,,[],,,8846233,807,false,,N/A
aHWWOsWyBT4,The eagle’s gratitude #animals #love #shorts,,JackieMcRe Y,,,"['https://en.wikipedia.org/wiki/Lifestyle_(sociology)', 'https://en.wikipedia.org/wiki/Pet']",,,8737225,1158,false,,N/A
8jH9ceve8aE,Funny ANIMALS videos😊Funniest CATS😹 and DOGS🐶 2024,Welcome to the entertainment channel World Fun Animals. Funny ANIMALS videos  Funniest CATS   and DOGS   2024 30 ...,World Fun Animals ,,,"['https://en.wikipedia.org/wiki/Humour', 'https://en.wikipedia.org/wiki/Lifestyle_(sociology)', 'https://en.wikipedia.org/wiki/Pet']",,,8689523,375,false,,N/A
MIxQGNGoNe4,Cute baby animals sound #shotrs,,Evasurajvlogs,,,['https://en.wikipedia.org/wiki/Entertainment'],,,8797879,669,false,,N/A
JRgUvQU9-Tg,World&#39;s smallest animals! #animals #foryou,foryou #animals #cute #animallover.,Gulraiz Khan ,,,['https://en.wikipedia.org/wiki/Entertainment'],,,8667707,438,false,,N/A
1yd2cIU9PEE,How Long Animals Can Hold Their Breath! 😱,BECOME A MEMBER OF THE CHANNEL - https://bit.ly/SubtoMunson Join Discord https://discord.gg/RcV22WkWEW ⚫Follow ...,Munson Reacts,,,['https://en.wikipedia.org/wiki/Entertainment'],,,8602203,674,false,,N/A
Nv7Ln8osHLc,Un ternero que se ganó el corazón de todos 🐮❤️ #animals #animales #shortsviral #love,Un ternero que se ganó el corazón de todos ❤️ #animals #animales #shortsviral #love.,Mascotas Increíbles,,,['https://en.wikipedia.org/wiki/Pet'],,,8578579,2370,false,,N/A
VphtcDhHj40,The World Through the Eyes of Animals,Did you know that animals see the world differently from us? Pigeons actually have better vision than humans. Cows can't see the ...,BRIGHT SIDE,,,[],,,8588233,1407,false,,N/A
mHjjzgHEImg,The Funny Animals 🤣😂 #funnyanimals #animals #pets #shorts,Which moment made you laugh the most? Let us know in the comments!     Pet Fun Funny animals fail videos.,Pet-Fun ,,,"['https://en.wikipedia.org/wiki/Entertainment', 'https://en.wikipedia.org/wiki/Humour', 'https://en.wikipedia.org/wiki/Pet']",,,8551939,144,false,,N/A
oDAwnJTL5l4,"Wild Animal Sounds In Nature: Elephant, Rooster, Cow, Horse, Dog, Hen, Duck,... | Animal Moments","Cute moments of animals as babies: monkey, duck, cow, chicken, cat, elephant, etc... ☆ If you enjoyed and learned ...",Wild Animal Sounds,,,['https://en.wikipedia.org/wiki/Lifestyle_(sociology)'],,,8545139,404,false,,N/A
XzvG_C0_WBk,"Paint &amp; Animals Ducks,Gorilla,Cow,Lion,Elephant,Bear Fountain Crossing Transformation Animal Cartoon","fountaincrossing #crossingfountain #gorilla #animalsgames #mysterykey #animalscagegame Paint & Animals Ducks,Gorilla,Cow ...",Animals Home Animation,,,"['https://en.wikipedia.org/wiki/Entertainment', 'https://en.wikipedia.org/wiki/Film']",,,8475272,294,false,,N/A
PMP8oTnBYk0,Beautiful shorthair cat #heartwarming #animals #animallover #cat,,mcclure dasilva,,,"['https://en.wikipedia.org/wiki/Lifestyle_(sociology)', 'https://en.wikipedia.org/wiki/Pet']",,,8366673,16021,false,,N/A
jdbA214QQIQ,Before &amp; After Animals Growing Up. Incredible Animal Transformations,"BRAIN TIME ▻ https://goo.gl/tTWgH2 Bloodthirsty alligators, feral cats, and tough watchdogs look cute as babies. Check our ...",BRAIN TIME,,,['https://en.wikipedia.org/wiki/Lifestyle_(sociology)'],,,8348129,354,false,,N/A
FzkRh6Z2bWk,"Top 10 Most Dangerous Animals in the World (Lion, Crocodile, Elephant)",animals #animal #lion #tiger #crocodile #elephant #snake #hippo.,Versus Zoo,,,"['https://en.wikipedia.org/wiki/Entertainment', 'https://en.wikipedia.org/wiki/Film']",,,8158187,912,false,,N/A
LyHn4Gyl9pQ,Animals,Provided to YouTube by IIP-DDS Animals · Martin Garrix Animals ℗ STMPD RCRDS Released on: 2013-06-17 Producer: Martin ...,Martin Garrix - Topic,,,"['https://en.wikipedia.org/wiki/Electronic_music', 'https://en.wikipedia.org/wiki/Music']",,,8144588,426,false,,N/A
aVj7C1ancUQ,leopard attack on  white baby calf #cow #calf #leopard #lion #tiger #animals #babyanimal #success,leopard attack on white baby calf @MohammadHussain-bp8nj @minebuilds-f4s @alphagamerhassan NOTE : THIS VIDEO IS ...,ALPHA CLUB,,,[],,,8086844,756,false,,N/A
IAYsNfg7-yg,The Animals - House Of The Rising Sun - Legendado + Análise da Letra,"Tradução com minha análise da letra depois que a música termina. Traduzido em português brasileiro, com legenda fixa no ...",Rock com Legendas,,,"['https://en.wikipedia.org/wiki/Music', 'https://en.wikipedia.org/wiki/Pop_music', 'https://en.wikipedia.org/wiki/Rock_music']",,,7925029,5055,true,,N/A
KfjIaEP0EtY,Animals of Asia 4K - Scenic Wildlife Film With Calming Music,Asia's wildlife is home to some of the world's most incredible animals. Enjoy this 4k scenic relaxation to witness the majestic ...,Scenic Relaxation,,,"['https://en.wikipedia.org/wiki/Film', 'https://en.wikipedia.org/wiki/Lifestyle_(sociology)', 'https://en.wikipedia.org/wiki/Tourism']",,,7885263,515,false,,N/A
GsoPwyStpJg,50 Animals Name and Sound | English | Animals for kids | WATRstar,50 Animals Name and Sound | English | Animals for kids | WATRstar This video will help the child to learn 50 Animals names and ...,WATRstar - The learning hub,,,[],,,7888106,0,false,,N/A
vbRWkhiIMNM,Why the puppy always abandoned?🥺🥺 #shortvideo #animals #cute #dog #lovestory,,Animal salvation ,,,"['https://en.wikipedia.org/wiki/Lifestyle_(sociology)', 'https://en.wikipedia.org/wiki/Pet']",,,7604743,2493,false,,N/A
RhOwyHWGqWg,Cute Baby Animals 🐻 4K - Relaxation Film with Peaceful Relaxing Music and Animals Video Ultra HD,This video captures the baby animals and the wild when they are young. you will find relaxation with the peaceful music and the ...,Relaxation Film,,,['https://en.wikipedia.org/wiki/Lifestyle_(sociology)'],,,7562975,0,false,,N/A
rFR1GBNEx7Q,🦖 Dinosaurs | 🐋 Whales | 🐘 Wild Animals | 🐠 Sea Animals,Dinosaurs Wild Animals Whales Sea Animals 00:00 Which of these animals is a Sperm Whale? 00:27 Which of ...,SmartKids YT,,,['https://en.wikipedia.org/wiki/Knowledge'],,,7553900,0,false,,N/A
Smc4slnnHj8,The cheetah failed to catch its prey #trending #shorts #short #animals #cheetah #wildlife #gazelle,"two cheetahs failed to catch a gazelle, The cheetah failed to catch its prey because he uses human technology, this is just an edit, ...",Rendi goodboy,,,['https://en.wikipedia.org/wiki/Entertainment'],,,7524557,618,false,,N/A
oSVc3h3YcyM,Color Cows Crocodiles and Horse Farm Adventures Farm Animals Comedy Video Collection 3D Cartoons,Watch Color Cows Crocodiles and Horse Farm Adventures Farm Animals Comedy Video Collection 3D Cartoons. #colorcows ...,Animals Time,,,"['https://en.wikipedia.org/wiki/Entertainment', 'https://en.wikipedia.org/wiki/Film', 'https://en.wikipedia.org/wiki/Humour']",,,7419504,241,false,,N/A
